# frozen_string_literal: true

FactoryBot.define do
  csv_data_full_example =
    <<-EOS
  ,,SAMPLE INFORMATION,,,,,,,,,,,,,,VOUCHERING,,,,EXTRACTION/QC,,,,,,,,,,,,,,,,Shear & SPRI QC,,,,,,,,,,,,,,,,,,,,,,,,,,,,,,,COLUMN JUST FOR TOL,COLUMN JUST FOR TOL,SE LIMS,,SEQUENCING DATA,,,,,,CROSS CHARGING,,,,,,
  Batch ,Tissue Tube ID,Sanger sample ID,Species,Genome Size,Tissue FluidX rack ID,Rack well location,Date Started,Owner/Operator,Crush Method,Tissue Mass (mg),Tissue type,Lysis ,DNA tube ID,DNAext FluidX Rack ID,Rack position,Voucher?,Voucher Tube ID,Voucher Rack ID,Sample Location,Qubit DNA Quant (ng/ul) [ESP1],DNA vol (ul),DNA total ng [ESP1],Femto dilution [ESP1],ND 260/280 [ESP1],ND 260/230 [ESP1],ND Quant (ng/ul) [ESP1],Femto Frag Size [ESP1],GQN >30000 [ESP1],Femto pdf [ESP1],LR EXTRACTION DECISION [ESP1],Sample Well Position in Plate,LMW Peak PE,Auto QC Recommendation,Comments [ESP1],TOL DECISION [ESP1],Date started,Operator,Pre-shear SPRI Vol input (uL),SPRI Volume (x0.6),Final Elution (uL),DNA Fluid+ MR kit for viscous DNA?,MR Machine ID,MR speed,Vol Input DNA MR3 (uL),SPRI Type,Save 1uL post shear,Vol Input SPRI (uL),SPRI volume (x0.6),Qubit Quant (ng/ul) [ESP2],Final Elution Volume (ul),Total DNA ng [ESP2],Femto Dil (ul) [ESP2],ND 260/280 [ESP2],ND 260/230 [ESP2],ND Quant (ng/uL) [ESP2],% DNA Recovery,Femto Fragment size [ESP2],GQN 10kb threshold [ESP2],Femto pdf [ESP2],LMW Peak PS,LR SHEARING DECISION [ESP2],Sample location,Sample Coordinate,Comments [ESP2],Date Complete,TOL DECISION [ESP2],ToL ID ,Genome size (TOL),SE Number,Sent to TOL?,PB comments/yields,Date in PB Lab (Auto),PB Lib Status,Traction ID,PB Run Status,PB CCS Yield (Gb),Additional Femto Charge,Additional Charge 2,Charging Status,Month Charged,Second Femto PDF,Femto Fragment size (mode),GQN 10kb threshold
  Production 1,FD20709764,DTOL12932860,,0.53,,,04/05/2022,lk11,Powermash,7.8,Non-plant,2h@25C,,,NA,Yes,FD38542652,SA00930879,A1,4.78,385,1840.3,18.12,2.38,0.57,14.9,22688,1.5,Extraction.Femto.9764-9765,Pass,,,"voucher, 10X, PacBio",,,05/05/2022,lk11,,,,,Alan Shearer/Britney Shears,30,,,FALSE,,,22.6,45.4,1026.04,89.4,1.92,1.79,33.7,55.8,9772,4.4,Sheared.Femto.9764-6843,,Pass,,,low fragment size,,,idCheUrba1,0.52725,SE293337P,TRUE,,24/06/2022,PASS,,PASS,20.18,FALSE,FALSE,Charge,August 2022,,,
  Production 1,FD20706871,DTOL12932868,,0.48,,,04/05/2022,sc45,Powermash,21,Non-plant,2h@25C,,,,Yes,FD38542653,SA00930879,B1,3.1,385,1193.5,11.4,1.79,0.33,7.4,44697,3.9,Extraction.Femto.9764-9765,Pass,,,"Check frag size >30kb voucher+PB, <30kb quality repeat",,,05/05/2022,lk11,,,,,Alan Shearer/Britney Shears,30,,,FALSE,,,15.8,45.4,717.32,62.2,1.85,1.25,26,60.1,14833,8.9,Sheared.Femto.9764-6843,,Pass,,,,,,ilNemSwae1,0.478,SE293338Q,TRUE,,24/06/2022,PASS,,PASS,27.56,FALSE,FALSE,Charge,August 2022,,,
  Production 1,FS05287128,DTOL12932865,,0.38,,,04/05/2022,mls,Powermash,8.7,Non-plant,2h@25C,,,,Yes,FD38542654,SA00930879,C1,7.58,385,2918.3,29.32,1.47,0.4,10,26330,2.9,Extraction.Femto.9764-9765,Pass,,,"voucher, PacBio",,,05/05/2022,lk11,,,,,Alan Shearer/Britney Shears,30,,,FALSE,,,38.6,45.4,1752.44,153.4,1.91,1.88,47.5,60.1,14620,7.6,Sheared.Femto.9764-6843,,Pass,,,,,,iyPanBank1,0.375,SE293345P,TRUE,SE293339R,24/06/2022,PASS,,PASS,26.04,FALSE,FALSE,Charge,August 2022,,,
  Production 1,FS05287158,DTOL12932866,,0.40,,,04/05/2022,sc45,Powermash,13.7,Non-plant,2h@25C,,,,Yes,FD38542655,SA00930879,D1,3.5,385,1347.5,13,1.64,0.3,7.7,20800,1.7,Extraction.Femto.9764-9765,Pass,,,"voucher, PacBio",,,05/05/2022,lk11,,,,,Alan Shearer/Britney Shears,30,,,FALSE,,,15.7,45.4,712.78,61.8,1.82,1.12,27.6,52.9,12178,6.3,Sheared.Femto.9764-6843,,Pass,,,,,,icLagHirt1,0.404073,SE293346Q,TRUE,SE293340K,24/06/2022,PASS,,PASS,29.55,FALSE,FALSE,Charge,August 2022,,,
  Production 1,FD20709486,DTOL12932858,,0.68,,,04/05/2022,lk11,Powermash,11.6,Non-plant,2h@25C,,,,Yes,FD38542656,SA00930879,E1,2.62,385,1008.7,9.48,1.29,0.3,7.2,29810,2.7,Extraction.Femto.9764-9765,Pass,,,"voucher, PacBio",,,05/05/2022,lk11,,,,,Alan Shearer/Britney Shears,30,,,FALSE,,,13.7,45.4,621.98,53.8,1.82,1.07,26.5,61.7,14620,7.3,Sheared.Femto.9764-6843,,Pass,,,,,,ihLegLimb1,0.676,SE293344O,TRUE,SE293341L,24/06/2022,PASS,,PASS,28.38,FALSE,FALSE,Charge,August 2022,,,
  Production 1,FD20709416,DTOL12932857,,0.45,,,04/05/2022,lk11,Powermash,8.2,Non-plant,2h@25C,,,,Yes,FD38542657,SA00930879,F1,8.52,385,3280.2,33.08,1.74,0.54,16.8,35639,3.3,Extraction.Femto.9764-9765,Pass,,,"voucher, PacBio",,,05/05/2022,lk11,,,,,Alan Shearer/Britney Shears,30,,,FALSE,,,40,45.4,1816,159,1.8,1.37,60.1,55.4,14567,7.5,Sheared.Femto.9764-6843,,Pass,,,,,,ilNycReva1,0.4485,SE293343N,TRUE,SE293342M,24/06/2022,PASS,,FAIL,5.36,FALSE,FALSE,Charge,August 2022,,,
  Production 1,FD20706843,DTOL12932856,,0.93,,,04/05/2022,fs17,Powermash,12.5,Non-plant,2h@25C,,,,Yes,FD38542658,SA00930879,G1,7.62,385,2933.7,29.48,1.83,0.46,18.6,27600,2.9,Extraction.Femto.9764-9765,Pass,,,"voucher, 10X, PacBio",,,05/05/2022,fs17,,,,,Alan Shearer/Britney Shears,30,,,FALSE,,,34.4,45.4,1561.76,136.6,1.83,1.41,49.2,53.2,11169,6.6,Sheared.Femto.9764-6843,,Pass,,,,,,ihElaGris1,0.931,SE293342M,TRUE,SE293343N,24/06/2022,PASS,,PASS,23.48,FALSE,FALSE,Charge,August 2022,,,
  Production 1,FD20706829,DTOL12932855,,0.89,,,04/05/2022,fs17,Powermash,9.4,Non-plant,2h@25C,,,,Yes,FD38542659,SA00930879,G2,11.6,385,4466,45.4,1.65,0.53,12.8,30265,2.8,Extraction.Femto.9764-9765,Pass,,,"voucher, 10X, PacBio",,,05/05/2022,fs17,,,,,Alan Shearer/Britney Shears,30,,,FALSE,,,63.4,45.4,2878.36,252.6,1.84,2,69.2,64.5,13876,6.6,Sheared.Femto.6829-8574,,Pass,,,,,,idPolDomi1,0.893108,SE293341L,TRUE,SE293344O,24/06/2022,PASS (Risk),,PASS,27.85,FALSE,FALSE,Charge,August 2022,,,
  Production 1,FD20706701,DTOL12932854,,0.31,,,04/05/2022,fs17,Powermash,11.4,Non-plant,2h@25C,,,,Yes,FD38542660,SA00930879,A2,7.66,385,2949.1,29.64,1.88,0.45,12.3,19561,1.5,Extraction.Femto.9764-9765,Pass,,,"voucher, PacBio",,,05/05/2022,fs17,,,,,Alan Shearer/Britney Shears,30,,,FALSE,,,46.4,45.4,2106.56,184.6,1.87,1.87,60.7,71.4,13976,4.7,Sheared.Femto.6829-8574,,Pass,,,,,,iyMacAlbo1,0.3095,SE293340K,TRUE,SE293345P,24/06/2022,PASS,,PASS,29.37,FALSE,FALSE,Charge,August 2022,,,
  Production 1,FB01533657,DTOL12932853,,0.40,,,04/05/2022,fs17,Powermash,15.3,Non-plant,2h@25C,,,,Yes,FD38542661,SA00930879,B2,2.78,385,1070.3,10.12,1.13,0.2,4.1,44540,3.8,Extraction.Femto.9764-9765,Pass,,,"voucher, PacBio",,,05/05/2022,fs17,,,,,Alan Shearer/Britney Shears,30,,,FALSE,,,20.2,45.4,917.08,79.8,1.95,1.75,24.7,85.7,14178,7.2,Sheared.Femto.6829-8574,,Pass,,,,,,icOedVire1,0.40098,SE293339R,TRUE,SE293346Q,24/06/2022,PASS,,PASS,20.40,FALSE,FALSE,Charge,August 2022,,,
  Production 1,FD20709765,DTOL12932861,,0.53,,,04/05/2022,sc45,Powermash,25.4,Non-plant,2h@25C,,,,Yes,FD38542662,SA00930879,C2,1.78,385,685.3,6.12,1.41,0.22,4.9,42411,4,Extraction.Femto.9764-9765,Pass,,,"voucher, PacBio",,,05/05/2022,fs17,,,,,Alan Shearer/Britney Shears,30,,,FALSE,,,8.3,45.4,376.82,32.2,1.77,1.33,13.3,55.0,14429,7.9,Sheared.Femto.6829-8574,,Fail,,,Fail on yield,,Submit to Lib Prep,iyNomRufi1,0.526649,SE302054K,TRUE,,27/09/2022,PASS (Risk),,PASS,27.56,FALSE,FALSE,Charge,August 2022,,,
  Production 1,FD20709684,DTOL12932859,,0.53,,,04/05/2022,lk11,Powermash,8,Non-plant,2h@25C,,,,Yes,FD38542663,SA00930879,D2,1.46,385,562.1,4.84,1.1,0.17,3.3,40132,3.6,Extraction.Femto.9684-8574,Pass,,,"voucher, 10X, PacBio",,,05/05/2022,fs17,,,,,Alan Shearer/Britney Shears,30,,,FALSE,,,11.7,45.4,531.18,45.8,1.91,1.29,17.1,94.5,17297,7.6,Sheared.Femto.6829-8574,,Pass,,,,,,iyNomMars1,0.526649,SE293347R,TRUE,,24/06/2022,FAIL,,Not in WGS,Not in WGS,FALSE,FALSE,Charge,August 2022,,,
  Production 1,FD20710430,DTOL12932862,,0.72,,,04/05/2022,sc45,Powermash,33,Non-plant,2h@25C,,,,Yes,FD38542664,SA00930879,E2,3.64,385,1401.4,13.56,1.61,0.22,4.5,37227,3.7,Extraction.Femto.9684-8574,Pass,,,"voucher, 10X, PacBio",,,05/05/2022,sc45,,,,,Alan Shearer/Britney Shears,30,,,FALSE,,,16,45.4,726.4,63,1.93,1.61,19.9,51.8,15888,7.5,Sheared.Femto.6829-8574,,Pass,,,,,,ilParSimi1,0.72481,SE293348S,TRUE,,24/06/2022,PASS (Risk),,PASS,30.14,FALSE,FALSE,Charge,August 2022,,,
  Production 1,FS05287060,DTOL12932864,,0.35,,,04/05/2022,sc45,Powermash,8.5,Non-plant,2h@25C,,,,Yes,FD38542665,SA00930879,F2,4.08,385,1570.8,15.32,1.88,0.5,12.4,47350,3.3,Extraction.Femto.9684-8574,Pass,,,"Check frag size >30kb voucher+PB, <30kb quality repeat",,,05/05/2022,sc45,,,,,Alan Shearer/Britney Shears,30,,,FALSE,,,26.8,45.4,1216.72,106.2,1.85,2.02,36.5,77.5,14379,7.3,Sheared.Femto.6829-8574,,Pass,,,,,,iyChaSisp2,0.353629,SE293349T,TRUE,,24/06/2022,PASS,,PASS,26.16,FALSE,FALSE,Charge,August 2022,,,
  Production 1,FS05287185,DTOL12932867,,1.97,,,04/05/2022,sc45,Powermash,18.1,Non-plant,2h@25C,,,,Yes,FD38542666,SA00930879,G2,3.7,385,1424.5,13.8,1.73,0.38,9.8,53048,3.9,Extraction.Femto.9684-8574,Pass,,,"voucher, PacBio",,,05/05/2022,sc45,,,,,Alan Shearer/Britney Shears,30,,,FALSE,,,17.1,45.4,776.34,67.4,1.85,1.19,23.2,54.5,16744,7.8,Sheared.Femto.6829-8574,,Pass,,,,,,icPhiPlag1,1.97248,SE293440N,TRUE,,28/06/2022,PASS,,PASS,24.92,FALSE,FALSE,Charge,August 2022,,,
  Production 1,FF10128574,DTOL12932863,,0.19,,,04/05/2022,sc45,Powermash,7.7,Non-plant,2h@25C,,,,Yes,FD38542667,SA00930879,H2,2.6,385,1001,9.4,1.82,0.55,20.7,12347,0.2,Extraction.Femto.9684-8574,Pass,,,"voucher, PacBio",,,05/05/2022,sc45,,,,,Alan Shearer/Britney Shears,30,,,FALSE,,,10.6,45.4,481.24,41.4,1.75,0.62,28.2,48.1,5477,0.4,Sheared.Femto.6829-8574,,Fail,Fail,,Fail on fragment size,,Fail,iyNemLatp1,0.1905,Failed Sample,FALSE,,,,,Not in WGS,Not in WGS,FALSE,FALSE,Charge,August 2022,,,
  Production 2,FD20706546,DTOL12932869,,0.59,,,09/05/2022,lk11/mls,Powermash,7.5,Non-plant,2h@25C,,,,Yes,FD38542668,SA00930879,A3,1.76,385,677.6,7.04,1.93,1.16,3,42969,4.3,Extraction.Femto.6546-9596,Pass,,,Hold for ULI,,,10/05/2022,lk11/mls,,,,,Ed Sheeran,30,,,FALSE,,,14.5,45.4,658.3,57,2.02,1.6,13.7,97.2,17396,7.8,Sheared.Femto.6546-9596,,Pass,,,,,,idNepScut1,0.589484,SE293393A,TRUE,,27/06/2022,PASS (Risk),,PASS,27.53,FALSE,FALSE,Charge,August 2022,,,
  Production 2,FD20706568,DTOL12932870,,0.64,,,09/05/2022,lk11/mls,Powermash,17.3,Non-plant,2h@25C,,,,Yes,FD38542669,SA00930879,B3,5.76,385,2217.6,23.04,1.86,1.23,9.3,37049,4.1,Extraction.Femto.6546-9596,Pass,,,"voucher, PacBio",,,10/05/2022,lk11/mls,,,,,Ed Sheeran,30,,,FALSE,,,37.4,45.4,1697.96,148.6,1.95,1.76,37.36,76.6,16079,7.5,Sheared.Femto.6546-9596,,Pass,,,,,,ilYpoCagn1,0.638667,SE293394B,TRUE,,27/06/2022,PASS,,PASS,25.33,FALSE,FALSE,Charge,August 2022,,,
  Production 2,FD20706711,DTOL12932871,,0.89,,,09/05/2022,lk11/mls,Powermash,14.8,Non-plant,2h@25C,,,,Yes,FD38542670,SA00930879,C3,5.1,385,1963.5,20.4,2.05,1.4,6.8,21570,2,Extraction.Femto.6546-9596,Pass,,,Manually review,,,10/05/2022,lk11/mls,,,,,Ed Sheeran,30,,,FALSE,,,33.8,45.4,1534.52,134.2,1.94,1.86,32.41,78.2,12989,6.1,Sheared.Femto.6546-9596,,Pass,,,,,,idPolMeri1,0.893108,SE293395C,TRUE,,27/06/2022,PASS,,PASS,21.13,FALSE,FALSE,Charge,August 2022,,,
  Production 2,FD20706809,DTOL12932872,,0.27,,,09/05/2022,lk11/mls,Powermash,25.7,Non-plant,2h@25C,,,,Yes,FD38542671,SA00930879,D3,6.38,385,2456.3,25.52,1.98,0.9,9.8,25250,2.6,Extraction.Femto.6546-9596,Pass,,,Manually review,,,10/05/2022,lk11/mls,,,,,Ed Sheeran,30,,,FALSE,,,38,45.4,1725.2,151,1.85,1.73,37.55,70.2,16029,6.6,Sheared.Femto.6546-9596,,Pass,,,,,,idNeoCyan1,0.273,SE293396D,TRUE,,27/06/2022,PASS,,PASS,25.00,FALSE,FALSE,Charge,August 2022,,,
  Production 2,FD20708082,DTOL12932873,,0.89,,,09/05/2022,lk11/mls,Powermash,6.4,Non-plant,2h@25C,,,,Yes,FD38542672,SA00930879,E3,2.78,385,1070.3,11.12,2.08,1.16,4.7,43191,3.9,Extraction.Femto.6546-9596,Pass,,,"voucher, PacBio",,,10/05/2022,lk11/mls,,,,,Ed Sheeran,30,,,FALSE,,,22.6,45.4,1026.04,89.4,1.86,1.57,20.98,95.9,16282,7,Sheared.Femto.6546-9596,,Pass,,,,,,idNeoCorn1,0.89433,SE293397E,TRUE,,27/06/2022,PASS (Risk),,PASS,24.85,FALSE,FALSE,Charge,August 2022,,,
  Production 2,FD20709369,DTOL12932874,,1.02,,,09/05/2022,lk11/mls,Powermash,4,Non-plant,2h@25C,,,,Yes,FD38542673,SA00930879,F3,1.84,385,708.4,7.36,1.75,0.85,3.6,32083,2.8,Extraction.Femto.6546-9596,Pass,,,"voucher, PacBio",,,10/05/2022,lk11/mls,,,,,Ed Sheeran,30,,,FALSE,,,11.6,45.4,526.64,45.4,2.04,1.3,12.88,74.3,16383,6.8,Sheared.Femto.6546-9596,,Pass,,,,,,idNorSpin1,1.018,SE293398F,TRUE,,27/06/2022,FAIL,,Not in WGS,Not in WGS,FALSE,FALSE,Charge,August 2022,,,
  Production 2,FD20709401,DTOL12932875,,0.53,,,09/05/2022,lk11/mls,Powermash,13.9,Non-plant,2h@25C,,,,Yes,FD38542674,SA00930879,G3,0.01,385,3.85,0.04,2.76,0.96,3.9,22675,2.4,Extraction.Femto.6546-9596,Pass,,,Quality and quantity repeat,,,10/05/2022,lk11/mls,,,,,Ed Sheeran,30,,,FALSE,,,17.6,45.4,799.04,69.4,1.85,1.45,16.11,20754.3,18222,7.5,Sheared.Femto.6546-9596,,Pass,,,,,,iyNomFerr1,0.526649,SE293441O,TRUE,,28/06/2022,PASS,,PASS,28.58,FALSE,FALSE,Charge,August 2022,,,
  Production 2,FD20709596,DTOL12932876,,0.95,,,09/05/2022,lk11/mls,Powermash,18,Non-plant,2h@25C,,,,Yes,FD38542675,SA00930879,H3,8.32,385,3203.2,33.28,1.99,1.04,17.9,33260,3.4,Extraction.Femto.6546-9596,Pass,,,"voucher, PacBio",,,10/05/2022,lk11/mls,,,,,Ed Sheeran,30,,,FALSE,,,61.6,45.4,2796.64,245.4,1.86,1.78,50.78,87.3,16180,7.9,Sheared.Femto.6546-9596,,Pass,,,,,,ihTroLuri1,0.952,SE293399G,TRUE,,27/06/2022,PASS,,FAIL INSTRUMENT,0.00,FALSE,FALSE,Charge,August 2022,,,
  Production 2,Control (5mil),,,#N/A,,,09/05/2022,lk11/mls,NA,NA,,2h@25C,FD32230252,fk00223822,A7,,NA,SA00930879,,8.12,385,3126.2,32.48,2.06,1.86,10.3,39212,4.3,Extraction.Femto.6546-9596,NA (control),,,,CGAP-23989B GM24385’,,,,,,,,,,,,,,,,,,,,,,0.0,,,,,,,,,,,,#N/A,CONTROL,FALSE,,,,,Not in WGS,Not in WGS,FALSE,FALSE,Charge,August 2022,,,
  Production 3,FD20709649,DTOL12932877,,0.53,,,11/05/2022,fs17,Powermash,4,Non-plant,2h@25C,FD20709649,,,Yes,FD38542676,SA00930879,A4,2.24,385,862.4,8.96,2.35,1.35,2.608,21285,1.9,2022 05 12 12H 15M,Pass,,,,,,12/05/2022,fs17/sc45,,,,,Britney Shears,30,,,FALSE,,,12.3,45.4,558.42,48.2,1.93,1.53,11.71,64.8,14977,7.5,2022 05 12 18H 08M,,Pass,,,,,,iyNomPanz1,0.526649,SE293413K,TRUE,,27/06/2022,n/a,,Not in WGS,Not in WGS,FALSE,FALSE,Charge,August 2022,,,
  Production 3,FD20709667,DTOL12932878,,0.53,,,11/05/2022,fs17,Powermash,19.4,Non-plant,2h@25C,FD20709667,,,Yes,FD38542677,SA00930879,B4,4.24,385,1632.4,16.96,2.19,2.21,3.328,22810,2.2,2022 05 12 12H 15M,Pass,,,,,,12/05/2022,fs17/sc45,,,,,Britney Shears,30,,,FALSE,,,22.4,45.4,1016.96,88.6,1.83,1.75,20.2,62.3,16024,7.7,2022 05 12 18H 08M,,Pass,,,,,,iyNomFlav1,0.526649,SE293414L,TRUE,,27/06/2022,n/a,,ABORTED - NEW RUN,0.00,FALSE,FALSE,Charge,August 2022,,,
  Production 3,FD20709682,DTOL12932879,,0.53,,,11/05/2022,fs17,Powermash,12.2,Non-plant,2h@25C,FD20709682,,,Yes,FD38542678,SA00930879,C4,3.02,385,1162.7,12.08,1.34,1.98,1.867,22349,2,2022 05 12 12H 15M,Pass,,,,,,12/05/2022,fs17/sc45,,,,,Britney Shears,30,,,FALSE,,,19.3,45.4,876.22,76.2,2.06,1.83,16.82,75.4,13615,7.2,2022 05 12 18H 08M,,Pass,,,,,,iyNomGood1,0.526649,SE293415M,TRUE,,27/06/2022,n/a,,Not in WGS,Not in WGS,FALSE,FALSE,Charge,August 2022,,,
  Production 3,FD20709740,DTOL12932880,,1.11,,,11/05/2022,fs17,Powermash,12.1,Non-plant,2h@25C,FD20709740,,,Yes,FD38542679,SA00930879,D4,13.4,385,5159,53.6,1.97,3.19,11.36,26403,2.5,2022 05 12 12H 15M,Pass,,,,,,12/05/2022,fs17/sc45,,,,,Britney Shears,30,,,FALSE,,,74.4,45.4,3377.76,296.6,1.82,2.06,63.31,65.5,16862,7.5,2022 05 12 18H 08M,,Pass,,,,,,idNepAppe1,1.106,SE293416N,TRUE,,27/06/2022,n/a,,ABORTED - NEW RUN,0.00,FALSE,FALSE,Charge,August 2022,,,
  Production 3,FD20709743,DTOL12932881,,0.53,,,11/05/2022,sc45,Powermash,23,Non-plant,2h@25C,FD20709743,,,Yes,FD38542680,SA00930879,E4,2.88,385,1108.8,11.52,2.21,3.38,3.31,25532,2.7,2022 05 12 12H 15M,Pass,,,,Difficult to homogenise,,12/05/2022,fs17/sc45,,,,,Britney Shears,30,,,FALSE,,,20.8,45.4,944.32,82.2,2,1.68,17.82,85.2,16443,7.9,2022 05 12 18H 08M,,Pass,,,,,,iyNomLath1,0.526649,SE293417O,TRUE,,27/06/2022,n/a,,PASS,26.02,FALSE,FALSE,Charge,August 2022,,,
  Production 3,FD20710511,DTOL12932882,,5.28,,,11/05/2022,sc45,Powermash,3.8,Non-plant,2h@25C,FD20710511,,,Yes,FD38542681,SA00930879,F4,2.76,385,1062.6,11.04,9.21,-0.59,1.273,23331,2.4,2022 05 12 12H 15M,Pass,,,,,,12/05/2022,fs17/sc45,,,,,Britney Shears,30,,,FALSE,,,12.9,45.4,585.66,50.6,1.85,1.16,14.65,55.1,16967,7.1,2022 05 12 18H 08M,,Pass,,,,,,ihMetRufe1,5.2812,SE293418P,TRUE,,27/06/2022,n/a,,Not in WGS,Not in WGS,FALSE,FALSE,Charge,August 2022,,,
  Production 3,FD20710553,DTOL12932883,,1.22,,,11/05/2022,sc45,Powermash,21.2,Non-plant,2h@25C,FD20710553,,,Yes,FD38542682,SA00930879,G4,6.7,385,2579.5,26.8,2.27,-9.83,5.119,10418,0.3,2022 05 12 12H 15M,Pass,,,,peak ~9000,,12/05/2022,fs17/sc45,,,,,Britney Shears,30,,,FALSE,,,36.8,45.4,1670.72,146.2,1.92,1.81,35.78,64.8,6631,1.8,2022 05 12 18H 08M,,Fail,,,Poor DNA extraction,,Direct to ULI,icNecLitt1,1.22,SE300141A,TRUE,,21/09/2022,n/a,,Not in WGS,Not in WGS,FALSE,FALSE,Charge,August 2022,,,
  Production 3,FD20710672,DTOL12932884,,0.39,,,11/05/2022,sc45,Powermash,7.7,Non-plant,2h@25C,FD20710672,,,Yes,FD38542683,SA00930879,H4,3.04,385,1170.4,12.16,3.22,-1.09,2.133,26880,3,2022 05 12 12H 15M,Pass,,,,,,12/05/2022,fs17/sc45,,,,,Britney Shears,30,,,FALSE,,,15.2,45.4,690.08,59.8,1.87,1.57,13.6,59.0,18781,8.3,2022 05 12 18H 08M,,Pass,,,,,,ilXanSpad1,0.39,SE293419Q,TRUE,,27/06/2022,n/a,,PASS,19.62,FALSE,FALSE,Charge,August 2022,,,
  Production 3,Control (5mil),,,#N/A,,,11/05/2022,sc45,NA,NA,Cell Line,2h@25C,Control,,,No,N/A,SA00930879,,5.7,385,2194.5,22.8,2.11,3.27,9.268,30851,3.2,2022 05 12 12H 15M,NA (control),,,,CACGAP-2398F5 / $GM24385 / PSG9 / 29/03/22; 12/28 batch 1,,,,,,,,,,,,,,,,,,,,,,0.0,,,,,,,,,,,,#N/A,CONTROL,FALSE,,,,,Not in WGS,Not in WGS,FALSE,FALSE,No Charge,CONTROL - do not charge,,,
  Production 4,FD20706604,DTOL12900727,,0.19,,,16/05/2022,sc45,Powermash,29,Non-plant,2h@25C,,,,Yes,FD38542684,SA00930879,A5,2.38,385,916.3,9.52,2.39,0.75,5.897,68339,6.4,2022 05 16 16H 00M,Pass,,,,,,17/05/2022,fs17/sc45,,,,,Britney Shears,30,350,0.6x AMPure PB (manual),FALSE,345,,10.8,45.4,490.32,42.2,1.54,0.84,27.1,53.5,10944,6.4,2022 05 17 17H 09M,,Pass,,,,,,iyPhyAter2,0.1905,SE290483M,TRUE,"PB Fail lib- lost sample in SS; recovered from Supernatant , maybe it would be seuqenced (on hold - Craig will look into it)",09/06/2022,n/a,,PASS,17.55,FALSE,FALSE,Charge,August 2022,,,
  Production 4,FD20706664,DTOL12900731,,0.11,,,16/05/2022,sc45,Powermash,0.01,Non-plant,2h@25C,FD32230250,fk00223822,D5,Yes,FD38542685,SA00930879,B5,0.284,385,109.34,1.136,0.76,0.81,-0.901,136027,5.7,2022 05 16 16H 00M,Fail,,,,low yield,,29/09/2022,mls,,,,,G-tube,2500,385,0.6x AMPure PB (manual),FALSE,340,204,3.38,46,155.48,,,,,142.2,12882,7.2,2022 10 03 16H 34M.raw,,Pass,,,,4/10/2022,Proceed with ULI,iuGraCruc1,0.10758,SE303465G,FALSE,,04/10/2022,n/a,,Not in WGS,Not in WGS,FALSE,FALSE,Charge,August 2022,,,
  Production 4,FD20706882,DTOL12900724,,6.64,,,16/05/2022,sc45,Powermash,21.3,Non-plant,2h@25C,FD32230249,fk00223822,C11,Yes,FD38542686,SA00930879,C5,7.96,385,3064.6,31.84,1.89,1,19.19,10809,0.3,2022 05 16 16H 00M,Pass,,,,peak ~8000,,17/05/2022,fs17/sc45,,,,,Britney Shears,30,188,0.6x AMPure PB (manual),FALSE,345,,19.2,45.4,871.68,75.8,1.88,1.21,27.9,28.4,5701,1.1,2022 05 17 17H 09M,,Fail,Fail,,Fail on fragment size,,Fail,iqTetUndu1,6.638175,Failed Sample,TRUE,,,,,Not in WGS,Not in WGS,FALSE,FALSE,Charge,August 2022,,,
  Production 4,FD20709573,DTOL12900732,,1.13,,,16/05/2022,sc45,Powermash,0.01,Non-plant,2h@25C,FD32230246,fk00223822,B5,Yes,FD38542687,SA00930879,D5,0.432,385,166.32,1.728,1.36,1.52,3.742,49751,4.8,2022 05 16 16H 00M,On Hold ULI,,,,good femto profile,,29/09/2022,mls,,,,,G-tube,2500,385,0.6x AMPure PB (manual),FALSE,340,204,3.88,46,178.48,,,,,107.3,12929,6.1,2022 10 03 16H 34M.raw,,Pass,,,,4/10/2022,Proceed with ULI,qqPseScor1,1.126878,SE303466H,TRUE,,04/10/2022,n/a,,Not in WGS,Not in WGS,FALSE,FALSE,Charge,August 2022,,,
  Production 4,FD20710373,DTOL12900723,,0.72,,,16/05/2022,sc45,Powermash,9.9,Non-plant,2h@25C,,,,Yes,FD38542688,SA00930879,E5,2.52,385,970.2,10.08,1.47,1.84,2.589,37843,4.2,2022 05 16 16H 00M,Pass,,,,,,17/05/2022,fs17/sc45,,,,,Britney Shears,30,350,0.6x AMPure PB (manual),FALSE,345,,7.22,45.4,327.788,27.88,1.91,1.43,7.8,33.8,15657,7.9,2022 05 17 17H 09M,,Fail,,,Failed on yield,,Submit to Lib Prep,ilLomBima1,0.72481,SE302055L,TRUE,,27/09/2022,n/a,,PASS,28.73,FALSE,FALSE,Charge,August 2022,,,
  Production 4,FD20710397,DTOL12900730,,0.50,,,16/05/2022,sc45,Powermash,6.8,Non-plant,2h@25C,,,,Yes,FD38542689,SA00930879,F5,1.3,385,500.5,5.2,2.31,3.96,1.08,32774,3.6,2022 05 16 16H 00M,Pass,,,,,,17/05/2022,fs17/sc45,,,,,Britney Shears,30,355,0.6x AMPure PB (manual),FALSE,345,,3.36,45.4,152.544,12.44,1.99,1.06,4.5,30.5,14296,7.5,2022 05 17 17H 09M,,Fail,,,Failed on yield,,Direct to ULI,ilHysMacu1,0.4965,SE300142B,TRUE,,21/09/2022,n/a,,Not in WGS,Not in WGS,FALSE,FALSE,Charge,August 2022,,,
  Production 4,FD20710447,DTOL12900726,,0.70,,,16/05/2022,sc45,Powermash,1.4,Non-plant,2h@25C,FD32230248,fk00223822,C6,Yes,FD38542690,SA00930879,G5,0.72,385,277.2,2.88,4.56,-2.76,0.7161,35482,3.9,2022 05 16 16H 00M,On Hold ULI,,,,ok,,21/09/2022,mls,,,,,G-tube,,,,FALSE,,,3.5,46,161,,,,,58.1,8534,1.6,2022 09 21 12H 49M,,Pass,,,,22/09/2022,Proceed with ULI,ilTelLucu1,0.702667,SE300153E,TRUE,,22/09/2022,63.1,,PASS,16.53,FALSE,FALSE,Charge,August 2022,,,
  Production 4,FD20710686,DTOL12900729,,0.22,,,16/05/2022,sc45,Powermash,0.01,Non-plant,2h@25C,FD32230247,fk00223822,B11,Yes,FD38542691,SA00930879,H5,0.386,385,148.61,1.544,0.64,0.97,-0.5415,37661,4.2,2022 05 16 16H 00M,On Hold ULI,,,,ok,,21/09/2022,mls,,,,,G-tube,,,,FALSE,,,1.9,46,87.4,,,,,58.8,8345,1.6,2022 09 21 12H 49M,,Pass,,,,22/09/2022,Proceed with ULI,ilPhyQuer1,0.218,SE300154F,TRUE,,22/09/2022,71.6,,PASS,16.91,FALSE,FALSE,Charge,August 2022,,,
  Production 4,Control (5mil),,,#N/A,,,16/05/2022,sc45,NA,NA,,2h@25C,FD32230251,fk00223822,D6,,N/A,SA00930879,,12.8,385,4928,51.2,1.96,2.24,16.99,63552,4.6,2022 05 16 16H 00M,NA (control),,,,CGAP-2398B9,,,,,,,,,,,,,,,,,,,,,,,,,,,,,,,,,,#N/A,CONTROL,TRUE,,,,,Not in WGS,Not in WGS,FALSE,FALSE,Charge,August 2022,,,
  Production 5,FF10128613,DTOL12900718,,0.66,,,23/05/2022,lk11,Cryoprep,35,Non-plant,2h@25C,FD32230128,,,Yes,FD38542556,SA00930879,A6,5.52,385,2125.2,22.08,1.02,0.77,18.06,66992,6.1,2022 05 24 09H 50M,Pass,,,,,,24/05/2022,lk11,,,,,Alan Shearer,30,360,0.6x AMPure PB (manual),FALSE,360,216,34.4,45.4,1561.76,136.6,1.85,1.77,34.99,73.5,14185,8.2,2022 05 31 16H 40M,,Pass,,,,,,ilOrtGoth1,0.6566,SE293255O,TRUE,,22/06/2022,13.8,,PASS,25.85,FALSE,FALSE,Charge,August 2022,,,
  Production 5,FF10128723,DTOL12900717,,0.44,,,23/05/2022,sc45,Powermash,2.8,Non-plant,2h@25C,,,,Yes,FD38542557,SA00930879,B6,0.78,385,300.3,3.12,2.43,0.71,2.94,37459,4,2022 05 24 09H 50M,On Hold ULI,,,,excellent femto profile,,21/09/2022,mls,,,,,G-tube,,,,FALSE,,,3.4,46,156.4,,,,,52.1,8203,1.3,2022 09 21 12H 49M,,Pass,,,,22/09/2022,Proceed with ULI,ilSubMega1,0.437,SE300155G,TRUE,,22/09/2022,49.5,,PASS,19.57,FALSE,FALSE,Charge,August 2022,,,
  Production 5,FF10137111,DTOL12900719,,0.65,,,23/05/2022,sc45,Powermash,21,Non-plant,2h@25C,,,,Yes,FD38542558,SA00930879,C6,0.82,385,315.7,3.28,1.74,1.04,5.08,34767,4.3,2022 05 24 09H 50M,On Hold ULI,,,,good femto profile,,21/09/2022,mls,,,,,G-tube,,,,FALSE,,,4.2,46,193.2,,,,,61.2,8369,1.5,2022 09 21 12H 49M,,Pass,,,,22/09/2022,Proceed with ULI,ilOliStri1,0.649935,SE300156H,TRUE,,22/09/2022,86.5,,PASS,17.46,FALSE,FALSE,Charge,August 2022,,,
  Production 5,FF10137227,DTOL12900722,,0.53,,,23/05/2022,lk11,Cryoprep,33,Non-plant,2h@25C,FD32230131,,,Yes,FD38542559,SA00930879,D6,3.48,385,1339.8,13.92,2.82,0.84,3.53,51189,5.2,2022 05 24 09H 50M,Pass,,,,,,24/05/2022,lk11,,,,,Alan Shearer,30,358,0.6x AMPure PB (manual),FALSE,358,214.8,20.2,45.4,917.08,79.8,2.02,2.03,18.36,68.4,13516,7.6,2022 05 27 14H 12M,,Pass,,,,,,iyMelHaem1,0.526264,SE293010S,TRUE,,09/06/2022,n/a,,PASS,31.84,FALSE,FALSE,Charge,August 2022,,,
  Production 5,FR25746472,DTOL12900728,,0.29,,,23/05/2022,sc45,Powermash,0.01,Non-plant,2h@25C,FD32230132,fk00223822,B3,Yes,FD38542560,SA00930879,E6,1.11,385,427.35,4.44,2.7,-1.72,0.863,22234,1.6,2022 05 24 09H 50M,Failed Profile,,,,Sample topped up to 400ul for automated SPRI. 1.06ng/ul 05/10/2022,PASS,04/10/2022,cj12,,,,,Ed Sheeran,,350,0.6x AMPure PB (manual),FALSE,350,,3.66,40,146.4,13.64,1.71,0.89,4.065,34.3,7650,5.5,2022 10 06 16H 24M,,Fail,Fail,,Strange profile to review,06/10/2022,Fail,qcSchNemo1,0.2934,,TRUE,,,,,Not in WGS,Not in WGS,FALSE,FALSE,Charge,August 2022,,,
  Production 5,FR25749420,DTOL12900720,,0.46,,,23/05/2022,sc45,Powermash,15.7,Non-plant,2h@25C,FD32230133,,,Yes,FD38542561,SA00930879,F6,2.54,385,977.9,10.16,1.65,1.99,1.91,30685,3,2022 05 24 09H 50M,Pass,,,,30% (30000-400K) but pass,,24/05/2022,zg1,,,,,Alan Shearer,30,358,0.6x AMPure PB (manual),FALSE,358,214.8,14.3,45.4,649.22,56.2,2.06,1.63,14.65,66.4,15078,7,2022 05 27 14H 12M,,Pass,,,,,,iyNetDila1,0.464883,SE293011T,TRUE,"PB low SS recovery 20.00Gb; loaded at ~half the concetration for sequencing, however got good amount of data generated",09/06/2022,n/a,,PASS,20.00,FALSE,FALSE,Charge,August 2022,,,
  Production 5,FR25749682,DTOL12900721,,0.11,,,23/05/2022,sc45,Powermash,1.3,Non-plant,2h@25C,,,,Yes,FD38542562,SA00930879,G6,0.692,385,266.42,2.768,2.46,-0.79,0.865,43037,4.8,2022 05 24 09H 50M,On Hold ULI,,,,good femto profile,,21/09/2022,mls,,,,,G-tube,,,,FALSE,,,2.4,46,110.4,,,,,41.4,8534,1.9,2022 09 21 12H 49M,,Pass,,,,22/09/2022,Proceed with ULI,iuMesFusc1,0.10758,SE300157I,TRUE,,22/09/2022,64.4,,PASS,18.26,FALSE,FALSE,Charge,August 2022,,,
  Production 5,FS05287072,DTOL12900725,,3.63,,,23/05/2022,lk11,Powermash,10.7,Non-plant,2h@25C,FD32230135,,,Yes,FD38542563,SA00930879,H6,4.26,385,1640.1,17.04,1.57,1.53,6.12,41956,4.7,2022 05 24 09H 50M,Pass,,,,,,24/05/2022,zg1,,,,,Alan Shearer,30,360,0.6x AMPure PB (manual),FALSE,360,216,21,45.4,953.4,83,1.58,1.7,27.79,58.1,14966,7.4,2022 05 27 14H 12M,,Pass,,,,,,qqMisVati1,3.62838,SE293254N,TRUE,,22/06/2022,n/a,,PASS,16.38,FALSE,FALSE,Charge,August 2022,,,
  Production 5,Control (5mil),,,#N/A,,,23/05/2022,lk11,NA,NA,Cell Line,2h@25C,FD32230139,,,No,N/A,SA00930879,,8.82,385,3395.7,35.28,1.94,1.77,9.02,34195,3.7,2022 05 24 15H 47M,NA (control),,,,"Poor profile, bulk below 50kb CGAP-23AC52 batch 2",,,,,,,,,,,,FALSE,,,,,,,,,,,,,,,,,,,,,,#N/A,CONTROL,TRUE,,,,,Not in WGS,Not in WGS,FALSE,FALSE,No Charge,CONTROL - do not charge,,,
  Production 5,FD20706615,DTOL12923662,,0.56,,,23/05/2022,lk11,Powermash,2.1,Non-plant,2h@25C,,,,Yes,FD38542564,SA00930879,A7,0.782,385,301.07,3.128,-0.55,1.51,0.267,51323,5.7,2022 05 24 15H 47M,On Hold ULI,,,,good femto profile,,21/09/2022,mls,,,,,G-tube,,,,FALSE,,,2.2,46,101.2,,,,,33.6,8156,1.1,2022 09 21 12H 49M,,Pass,,,,22/09/2022,Proceed with ULI,ihDrePlat2,0.564985,SE300158J,TRUE,,22/09/2022,51.6,,PASS,18.30,FALSE,FALSE,Charge,August 2022,,,
  Production 5,FD20706764,DTOL12923657,,0.42,,,23/05/2022,lk11,Powermash,21.2,Non-plant,2h@25C,FD32230141,,,Yes,FD38542565,SA00930879,B7,4.66,385,1794.1,18.64,2.21,2.85,3.81,37868,4,2022 05 24 15H 47M,Pass,,,,,,26/05/2022,sc45,,,,,Alan Shearer,30,370,0.6x AMPure PB (manual),FALSE,370,222,23.4,45.4,1062.36,92.6,1.76,1.74,24.69,59.2,15022,7.7,2022 05 27 14H 12M,,Pass,,,,,,idBraLaph1,0.417,SE293012U,TRUE,,09/06/2022,n/a,,PASS,30.19,FALSE,FALSE,Charge,August 2022,,,
  Production 5,FD20706771,DTOL12923653,,2.06,,,23/05/2022,lk11,Powermash,7.2,Non-plant,2h@25C,FD32230142,,,Yes,FD38542566,SA00930879,C7,6.06,385,2333.1,24.24,1.73,2.56,11.08,29663,3.1,2022 05 24 15H 47M,Pass,,,,Good yield but bulk below 50kb,,26/05/2022,sc45,,,,,Alan Shearer,30,370,0.6x AMPure PB (manual),FALSE,370,222,41.2,45.4,1870.48,163.8,1.67,1.79,45.2,80.2,12177,6.2,2022 05 27 14H 12M,,Pass,,,,,,qqGibGibb2,2.057579,SE293013V,TRUE,,09/06/2022,27.5,,PASS,25.41,FALSE,FALSE,Charge,August 2022,,,
  Production 6,FD20709371,DTOL12923659,,1.02,,,25/05/2022,sc45,Powermash,4.5,Non-plant,2h@25C,,,,Yes,FD38542568,SA00930879,E7,1.09,380,414.2,4.36,21.8,0.61,1.075,58081,5.8,2022 05 25 16H 51M,Pass,,,,final volume less than 400uL,,26/05/2022,zg1,,,,,Alan Shearer,30,370,0.6x AMPure PB (manual),FALSE,370,222,4.42,45.4,200.668,16.68,2.15,1.28,4.39,48.4,14799,8.2,2022 05 27 14H 12M,,Pass,,,"resheared for ULI 2.76ng/ul in 45ul (124.2) Fragment size 12,249",11/10/2022,Proceed with ULI,idNorSpin2,1.018,SE304473K,TRUE,,11/10/2022,29.2,,,0.00,FALSE,FALSE,Charge,August 2022,2022 10 10 17H 07M.raw,,
  Production 5,FD20709399,DTOL12923664,,0.28,,,23/05/2022,lk11,Powermash,4.2,Non-plant,2h@25C,,,,Yes,FD38542567,SA00930879,D7,0.678,385,261.03,2.712,-0.17,-0.15,0.147,47675,3.5,2022 05 24 15H 47M,On Hold ULI,,,,good femto profile,,21/09/2022,mls,,,,,G-tube,,,,FALSE,,,1.59,46,73.14,,,,,28.0,8227,1.3,2022 09 21 12H 49M,,Pass,,,,22/09/2022,Proceed with ULI,iyLasFuli2,0.28362,SE300159K,TRUE,,22/09/2022,26.6,,PASS,22.72,FALSE,FALSE,Charge,August 2022,,,
  Production 6,FD20709686,DTOL12923661,,0.53,,,25/05/2022,sc45,Powermash,19.4,Non-plant,2h@25C,,,,Yes,FD38542569,SA00930879,F7,1.02,380,387.6,4.08,1.85,-1.45,0.7035,21739,1.9,2022 05 25 16H 51M,On Hold ULI,,,,suboptimal femto profile? but...,,21/09/2022,mls,,,,,G-tube,,,,FALSE,,,4.3,46,197.8,,,,,51.0,8558,1.8,2022 09 21 12H 49M,,Pass,,,,22/09/2022,Proceed with ULI,iyNomGood2,0.526649,SE300160D,TRUE,,22/09/2022,102.3,,PASS,23.36,FALSE,FALSE,Charge,August 2022,,,
  Production 6,FD20709695,DTOL12923660,,0.53,,,25/05/2022,sc45,Powermash,10.7,Non-plant,2h@25C,FD32230138,fk00223822,D7,Yes,FD38542570,SA00930879,G7,1.51,380,573.8,6.04,1.46,1.76,1.578,20086,1.7,2022 05 25 16H 51M,Pass,,,,em passed this sample on 17th aug 2022,,23/08/2022,fs17,,,,,Alan Shearer,30,358,0.6x AMPure PB (manual),TRUE,338,202.8,10.5,46,483,41,2.4,1.71,8.919,84.2,14958,6.9,2022 08 24 15H 45M,,Pass,,,,25/08/2022,,iyNomPanz2,0.526649,SE297149G,TRUE,,26/08/2022,n/a,,PASS,16.49,FALSE,FALSE,Charge,August 2022,,,
  Production 6,FD20710517,DTOL12923665,,0.67,,,25/05/2022,sc45,Powermash,10.9,Non-plant,2h@25C,FD32230144,,,Yes,FD38542571,SA00930879,H7,2.72,380,1033.6,10.88,1.83,1.93,2.851,26217,2.7,2022 05 25 16H 51M,Pass,,,,tissue sample a bit viscous after lysis,,29/06/2022,fs17,,,,,Alan Shearer,30,355,0.6x AMPure PB (manual),TRUE,340,204,18.4,45.4,835.36,,2.07,1.5,17.25,80.8,14470,7.6,2022 06 30 13H 06M,,Pass,,,,,,ilAclLite1,0.674667,SE293533R,TRUE,,05/07/2022,n/a,,PASS,23.63,FALSE,FALSE,Charge,August 2022,,,
  Production 6,FD20710630,DTOL12923666,,1.42,,,25/05/2022,sc45,Powermash,0.9,Non-plant,2h@25C,FD32230145,fk00223822,A2,Yes,FD38542572,SA00930879,A8,1.3,380,494,5.2,6.54,0.77,0.9375,28324,3,2022 05 25 16H 51M,Pass,,,,em passed this sample on 17th aug 2022,,23/08/2022,fs17,,,,,Alan Shearer,30,366,0.6x AMPure PB (manual),TRUE,350,210,9.44,46,434.24,36.76,1.99,1.43,8.067,87.9,15538,7.9,2022 08 24 15H 45M,,Pass,,,,25/08/2022,,icAdrPall1,1.4181,SE297150W,TRUE,,26/08/2022,n/a,,FAIL,1.01,FALSE,FALSE,Charge,August 2022,,,
  Production 6,FD20710680,DTOL12923658,,1.03,,,25/05/2022,fs17,Powermash,10.4,Non-plant,2h@25C,FD32230146,,,Yes,FD38542573,SA00930879,B8,4.82,380,1831.6,19.28,3.95,9.88,3.681,23483,2.3,2022 05 25 16H 51M,Pass,,,,,,29/06/2022,fs17,,,,,Alan Shearer,30,360,0.6x AMPure PB (manual),TRUE,340,204,38.2,45.4,1734.28,,2.07,2.13,30.45,94.7,16677,7.6,2022 06 30 13H 06M,,Pass,,,,,,ilTriEmor1,1.0269,SE293536U,TRUE,,05/07/2022,13.2,,PASS,18.19,FALSE,FALSE,Charge,August 2022,,,
  Production 6,FD20710742,DTOL12923652,,0.72,,,25/05/2022,fs17,Powermash,9,Non-plant,2h@25C,FD32230147,,,Yes,FD38542574,SA00930879,C8,4.06,380,1542.8,16.24,2.18,-23.77,3.69,24412,2.6,2022 05 25 16H 51M,Pass,,,,,,29/06/2022,fs17,,,,,Alan Shearer,30,350,0.6x AMPure PB (manual),TRUE,328,196.8,29.8,45.4,1352.92,,1.89,1.94,24.82,87.7,15116,8.2,2022 06 30 13H 06M,,Pass,,,,,,ilLigAdus1,0.72481,SE293534S,TRUE,,05/07/2022,10.3,,PASS,22.52,FALSE,FALSE,Charge,August 2022,,,
  Production 6,FD20710755,DTOL12923655,,0.28,,,25/05/2022,fs17,Powermash,9.1,Non-plant,2h@25C,FD32230148,,,Yes,FD38542575,SA00930879,D8,3.52,380,1337.6,14.08,2.38,2.08,3.945,24884,2.6,2022 05 25 16H 51M,Pass,,,,,,29/06/2022,fs17,,,,,Alan Shearer,30,360,0.6x AMPure PB (manual),TRUE,342,205.2,27.8,45.4,1262.12,,1.93,1.94,22.16,94.4,17108,7.5,2022 06 30 13H 06M,,Pass,,,,,,idDicObli2,0.2848,SE293535T,TRUE,,05/07/2022,10,,PASS,23.36,FALSE,FALSE,Charge,August 2022,,,
  Production 6,FF10137183,DTOL12923656,,0.64,,,25/05/2022,fs17,Cryoprep,33.5,Non-plant,2h@25C,FD32230149,,,Yes,FD38542576,SA00930879,E8,4.58,380,1740.4,18.32,2.36,2.3,5.79,28714,3.4,2022 05 25 18H 19M,Pass,,,,,,26/05/2022,zg1,,,,,Alan Shearer,30,370,0.6x AMPure PB (manual),FALSE,370,222,28.4,45.4,1289.36,112.6,2.18,2.32,25.47,74.1,10879,6.1,2022 05 27 15H 40M,,Pass,,,"sample needs to be pushed, could not be passed 26/08/22, no data in SE LIMS. 14/10/2022: sample passed into SE LIMS!!",,,ilDiaMend1,0.644467,SE305475Q,TRUE,,14/10/2022,22.4,,PASS,30.45,FALSE,FALSE,Charge,August 2022,,,
  Production 6,FR25749456,DTOL12923651,,1.99,,,25/05/2022,fs17,Powermash,9.3,Non-plant,2h@25C,FD32230150,,,Yes,FD38542577,SA00930879,F8,5.28,380,2006.4,21.12,1.82,2.14,10.36,34884,4.3,2022 05 25 18H 19M,Pass,,,,,,26/05/2022,lk11,,,,,Alan Shearer,30,370,0.6x AMPure PB (manual),FALSE,370,222,32.8,45.4,1489.12,130.2,1.9,1.91,32.7,74.2,13986,8.2,2022 05 27 15H 40M,,Pass,,,,,,qcLitMuti2,1.98534,SE293251K,TRUE,,22/06/2022,13.6,,PASS,22.07,FALSE,FALSE,Charge,August 2022,,,
  Production 6,FS05287084,DTOL12923663,,0.43,,,25/05/2022,fs17,Powermash,7.2,Non-plant,2h@25C,FD32230151,,,Yes,FD38542578,SA00930879,G8,8.3,380,3154,33.2,2.08,1.94,14.64,32279,4,2022 05 25 18H 19M,Pass,,,,,,26/05/2022,lk11,,,,,Alan Shearer,30,370,0.6x AMPure PB (manual),FALSE,200,120,25.4,45.4,1153.16,100.6,1.91,1.8,26.13,36.6,12635,7.4,2022 05 27 15H 40M,,Pass,,,,,,icCryMora2,0.42706,SE293252L,TRUE,,22/06/2022,n/a,,PASS,25.09,FALSE,FALSE,Charge,August 2022,,,
  Production 6,FS05304201,DTOL12923654,,0.62,,,25/05/2022,fs17,Powermash,7.2,Non-plant,2h@25C,FD32230152,,,Yes,FD38542579,SA00930879,H8,2.46,380,934.8,9.84,1.79,1.28,3.279,44582,4.8,2022 05 25 18H 19M,Pass,,,,,,26/05/2022,lk11,,,,,Alan Shearer,30,370,0.6x AMPure PB (manual),FALSE,370,222,15.2,45.4,690.08,59.8,1.72,1.12,21.53,73.8,10339,5.6,2022 05 27 15H 40M,,Pass,,,,,,idEumSabu1,0.615602,SE293253M,TRUE,,22/06/2022,n/a,,PASS,26.69,FALSE,FALSE,Charge,August 2022,,,
  Production 6,Control (5mil),,,#N/A,,,25/05/2022,lk11,NA,NA,Cell Line,2h@25C,FD32230153,,,No,N/A,SA00930879,,8.36,380,3176.8,33.44,2,2.31,15.61,29386,3,2022 05 25 18H 19M,NA (control),,,,CA CGAP-23ABA0 batch 2,,,,,,,,,,,,,,,,,,,,,,,,,,,,,,NA,,,,#N/A,CONTROL,TRUE,,,,,Not in WGS,Not in WGS,FALSE,FALSE,No Charge,CONTROL - do not charge,,,
  Production 7,FD20706435,DTOL12931661,,0.58,,,07/06/2022,fs17,Powermash,7.4,Non-plant,2h@25C,FD32230154,,,Yes,FD38542581,SA00930879,A9,4.24,380,1611.2,16.96,1.9,3.59,4.83,27456,2.8,2022 06 07 16H 50M,Pass,,,,em,,09/06/2022,zg1,,,,,Ed Sheeran,30,362,0.6x AMPure PB (manual),TRUE,335,201,31.4,45.4,1425.56,124.6,1.87,1.91,31.82,88.5,17054,8.2,2022 06 09 16H 24M,,Pass,,,,,,ilEleSimi1,0.582662,SE293033C,TRUE,,10/06/2022,12.8,,PASS,29.34,FALSE,FALSE,Charge,August 2022,,,
  Production 7,FD20706528,DTOL12931662,,0.67,,,07/06/2022,fs17,Powermash,10.7,Non-plant,2h@25C,FD32230155,,,Yes,FD38542582,SA00930879,B9,5.02,380,1907.6,20.08,2.71,4.87,4.997,25986,2.4,2022 06 07 16H 50M,Pass,,,,em,,09/06/2022,zg1,,,,,Ed Sheeran,30,358,0.6x AMPure PB (manual),TRUE,345,207,38.8,45.4,1761.52,154.2,1.91,2.3,34.78,92.3,14039,7.5,2022 06 09 16H 24M,,Pass,,,,,,ilEudProf1,0.668,SE293034D,TRUE,,10/06/2022,23.5,,PASS,29.95,FALSE,FALSE,Charge,August 2022,,,
  Production 7,FD20706538,DTOL12931663,,0.47,,,07/06/2022,fs17,Powermash,5.3,Non-plant,2h@25C,FD32230156,,,Yes,FD38542583,SA00930879,C9,4.5,380,1710,18,1.97,1.78,9.112,34318,3.2,2022 06 07 16H 50M,Pass,,,,em,,09/06/2022,zg1,,,,,Ed Sheeran,30,347,0.6x AMPure PB (manual),TRUE,345,207,27,45.4,1225.8,107,1.95,1.46,32.25,71.7,14254,7.5,2022 06 09 16H 24M,,Pass,,,,,,irXanXant1,0.474101,SE293070H,TRUE,,15/06/2022,n/a,,PASS,21.08,FALSE,FALSE,Charge,August 2022,,,
  Production 7,FD20706713,DTOL12931664,,0.64,,,07/06/2022,fs17,Powermash,10.9,Non-plant,2h@25C,FD32230157,,,Yes,FD38542584,SA00930879,D9,4.06,380,1542.8,16.24,2.47,2.99,4.884,22729,2.1,2022 06 07 16H 50M,Pass,,,,em,,10/06/2022,zg1/sc45,,,,,Ed Sheeran,30,350,0.6x AMPure PB (manual),TRUE,349,209.4,29.6,45.4,1343.84,117.4,1.8,1.58,31.2,87.1,15720,7.7,2022 06 10 16H 01M,,Pass,,,,,,idEpiEuco1,0.643589,SE293071I,TRUE,,15/06/2022,9.1,,PASS,24.45,FALSE,FALSE,Charge,August 2022,,,
  Production 7,FD20706719,DTOL12931665,,0.47,,,07/06/2022,fs17,Powermash,12.1,Non-plant,2h@25C,FD32230158,,,Yes,FD38542585,SA00930879,E9,6.72,380,2553.6,26.88,2.45,3.4,6.915,31612,3.4,2022 06 07 16H 50M,Pass,,,,,,09/06/2022,zg1,,,,,Ed Sheeran,30,358,0.6x AMPure PB (manual),TRUE,330,198,59,45.4,2678.6,235,1.82,1.82,40.73,104.9,17162,7.6,2022 06 09 16H 24M,,Pass,,,,,,iyArgMyst1,0.46944,SE293072J,TRUE,,15/06/2022,14.7,,ABORTED,0.00,FALSE,FALSE,Charge,August 2022,,,
  Production 7,FD20706822,DTOL12931666,,0.46,,,07/06/2022,fs17,Powermash,8.1,Non-plant,2h@25C,FD32230159,,,Yes,FD38542586,SA00930879,F9,2.7,380,1026,10.8,3.03,-70.84,3.027,27399,2.5,2022 06 07 16H 50M,Pass,,,,em,,10/06/2022,zg1/sc45,,,,,Ed Sheeran,30,360,0.6x AMPure PB (manual),TRUE,344,206.4,21,45.4,953.4,83,1.89,1.64,20.45,92.9,16600,8,2022 06 10 16H 01M,,Pass,,,,,,iyAllPice1,0.464883,SE293073K,TRUE,,15/06/2022,n/a,,PASS,26.84,FALSE,FALSE,Charge,August 2022,,,
  Production 7,FD20706827,DTOL12931667,,0.40,,,07/06/2022,fs17,Powermash,24,Non-plant,2h@25C,FD32230160,,,Yes,FD38542587,SA00930879,G9,6.88,380,2614.4,27.52,1.74,2.31,9.02,24846,2.3,2022 06 07 16H 50M,Pass,,,,em,,10/06/2022,zg1/sc45,,,,,Ed Sheeran,30,355,0.6x AMPure PB (manual),TRUE,324,194.4,46.6,45.4,2115.64,185.4,1.93,1.95,59.56,80.9,10386,5.9,2022 06 10 16H 01M,,Pass,,,double check frag size 10kb. Passed 01/08/2022,,,iyAndPrae1,0.4005,SE294640A,TRUE,,05/08/2022,32.6,,PASS,26.79,FALSE,FALSE,Charge,August 2022,,,
  Production 7,FD20706863,DTOL12931668,,0.38,,,07/06/2022,fs17,Powermash,24.9,Non-plant,2h@25C,FD32230161,,,Yes,FD38542588,SA00930879,H9,5.28,380,2006.4,21.12,2.26,5.31,7.62,19757,1.5,2022 06 07 18H 19M,Pass,,,,"15%, em",,10/06/2022,zg1/sc45,,,,,Ed Sheeran,30,360,0.6x AMPure PB (manual),TRUE,349,209.4,38.4,45.4,1743.36,152.6,1.88,1.91,38.07,86.9,13356,6.9,2022 06 10 16H 01M,,Pass,,,,,,iyAndBuce1,0.375,SE293074L,TRUE,,15/06/2022,16.3,,PASS,22.53,FALSE,FALSE,Charge,August 2022,,,
  Production 7,FD20706869,DTOL12931669,,0.66,,,07/06/2022,fs17,Powermash,9.6,Non-plant,2h@25C,FD32230162,,,Yes,FD38542589,SA00930879,A10,4,380,1520,16,2.6,3.25,5.481,29225,3.2,2022 06 07 18H 19M,Pass,,,,,,09/06/2022,sc45,,,,,Ed Sheeran,30,360,0.6x AMPure PB (manual),TRUE,335,201,27,45.4,1225.8,107,1.92,1.74,26.35,80.6,16892,7.8,2022 06 09 16H 24M,,Pass,,,,,,idDasAlbo1,0.65758,SE293075M,TRUE,,15/06/2022,n/a,,PASS,23.02,FALSE,FALSE,Charge,August 2022,,,
  Production 7,FD20709391,DTOL12931670,,0.68,,,07/06/2022,fs17,Powermash,10.1,Non-plant,2h@25C,FD32230163,,,Yes,FD38542590,SA00930879,B10,2.76,380,1048.8,11.04,31.74,0.52,2.433,24512,2.3,2022 06 07 18H 19M,Pass,,,,em,,10/06/2022,zg1/sc45,,,,,Ed Sheeran,30,352,0.6x AMPure PB (manual),TRUE,346,207.6,16.9,45.4,767.26,66.6,1.64,1.15,18.13,73.2,16985,7.9,2022 06 10 16H 01M,,Pass,,,,,,ihTriBico1,0.676,SE293076N,TRUE,,15/06/2022,n/a,,PASS,22.69,FALSE,FALSE,Charge,August 2022,,,
  Production 7,FD20709406,DTOL12931671,,0.49,,,07/06/2022,fs17,Powermash,3.9,Non-plant,2h@25C,FD32230164,,,Yes,FD38542591,SA00930879,C10,1.61,380,611.8,6.44,-3.78,2.91,1.112,23326,2.2,2022 06 07 18H 19M,Pass,,,,em,,10/06/2022,zg1/sc45,,,,,Ed Sheeran,30,350,0.6x AMPure PB (manual),TRUE,342,205.2,10.2,45.4,463.08,39.8,1.85,1.32,12.11,75.7,15940,8.1,2022 06 10 16H 01M,,Pass,,,,,,ilEriSemi1,0.488542,SE293077O,TRUE,PB Fail lib - very low recovery. Not enough for loading (Seq Batch#2),15/06/2022,n/a,,Not in WGS,Not in WGS,FALSE,FALSE,Charge,August 2022,,,
  Production 7,FD20709428,DTOL12931672,,0.54,,,07/06/2022,fs17,Powermash,10.6,Non-plant,2h@25C,FD32230165,,,Yes,FD38542592,SA00930879,D10,4.86,380,1846.8,19.44,2.21,3.35,5.79,22832,2.1,2022 06 07 18H 19M,Pass,,,,em,,10/06/2022,zg1/sc45,,,,,Ed Sheeran,30,355,0.6x AMPure PB (manual),TRUE,332,199.2,30.8,45.4,1398.32,122.2,1.92,1.77,32.05,75.7,15720,7,2022 06 10 16H 01M,,Pass,,,,,,ilAlsAesc1,0.543899,SE293078P,TRUE,,15/06/2022,n/a,,PASS,24.40,FALSE,FALSE,Charge,August 2022,,,
  Production 7,FD20709482,DTOL12931673,,0.38,,,07/06/2022,sc45,Powermash,36,Non-plant,2h@25C,FD32230166,,,Yes,FD38542593,SA00930879,E10,4.26,380,1618.8,17.04,2.37,1.25,4.504,19496,1.4,2022 06 07 18H 19M,Pass,,,,em,,10/06/2022,zg1/sc45,,,,,Ed Sheeran,30,350,0.6x AMPure PB (manual),TRUE,344,206.4,24.2,45.4,1098.68,95.8,1.9,1.47,26.4,67.9,15335,7,2022 06 10 16H 01M,,Pass,,,,,,iyAndTrim1,0.375,SE293079Q,TRUE,,15/06/2022,10.4,,PASS,26.27,FALSE,FALSE,Charge,August 2022,,,
  Production 7,FD20709548,DTOL12931674,,4.94,,,07/06/2022,sc45,Powermash,10.6,Non-plant,2h@25C,FD32230167,,,Yes,FD38542594,SA00930879,F10,3.92,380,1489.6,15.68,2.27,33,9.294,18568,1.1,2022 06 07 18H 19M,Pass,,,,Pass - checked by em27 on 28/6/2022 // 11%!!! ? still deciding... shal we pass it just to try and see how this works in the end?,,29/06/2022,fs17,,,,,Alan Shearer,30,360,0.6x AMPure PB (manual),TRUE,345,207,28.6,45.4,1298.44,,1.97,1.65,28.29,87.2,13824,6,2022 06 30 13H 06M,,Pass,,,pass during meeting,,,qmTraRath1,4.94379,SE293537V,TRUE,,05/07/2022,n/a,,Not in WGS,Not in WGS,FALSE,FALSE,Charge,August 2022,,,
  Production 7,FD20709607,DTOL12931675,,0.38,,,07/06/2022,sc45,Powermash,29,Non-plant,2h@25C,FD32230168,,,Yes,FD38542595,SA00930879,G10,3.84,380,1459.2,15.36,2.17,1.53,4.189,21109,1.8,2022 06 07 18H 19M,Pass,,,,em,,10/06/2022,zg1/sc45,,,,,Alan Shearer,30,350,0.6x AMPure PB (manual),TRUE,328,196.8,28.2,45.4,1280.28,111.8,1.89,1.72,27.82,87.7,15940,7.2,2022 06 10 16H 01M,,Pass,,,,,,iyAndCara1,0.375,SE293080J,TRUE,,15/06/2022,n/a,,FAIL INSTRUMENT,0.00,FALSE,FALSE,Charge,August 2022,,,
  Production 7,FD20709719,DTOL12931676,,0.40,,,07/06/2022,sc45,Powermash,16.2,Non-plant,2h@25C,FD32230169,,,Yes,FD38542596,SA00930879,H10,4.84,380,1839.2,19.36,2.04,2.82,5.054,22471,1.9,2022 06 07 18H 19M,Pass,,,,em,,10/06/2022,zg1/sc45,,,,,Alan Shearer,30,350,0.6x AMPure PB (manual),TRUE,336,201.6,30.2,45.4,1371.08,119.8,1.85,1.94,28.58,74.5,15500,7.2,2022 06 10 16H 01M,,Pass,,,,,,iyAndHelv1,0.4005,SE293081K,TRUE,,15/06/2022,11.9,,ABORTED - NEW RUN,0.00,FALSE,FALSE,Charge,August 2022,,,
  Production 7,FD20709767,DTOL12931677,,0.33,,,07/06/2022,sc45,Powermash,7.3,Non-plant,2h@25C,,,,Yes,FD38542597,SA00930879,A11,0.98,380,372.4,3.92,-4.78,-0.67,0.8061,22801,1.9,2022 06 07 18H 19M,On Hold ULI,,,,"Poor profile, low yield",,21/09/2022,mls,,,,,G-tube,,,,,,,4.4,46,202.4,,,,,54.4,8133,1.2,2022 09 21 12H 49M,,Pass,,,,22/09/2022,Proceed with ULI,idMyoTest1,0.332,SE300161E,TRUE,,22/09/2022,73.9,,PASS,26.27,FALSE,FALSE,Charge,August 2022,,,
  Production 7,FD20709780,DTOL12931678,,0.87,,,07/06/2022,sc45,Powermash,11.5,Non-plant,2h@25C,FD32230171,,,Yes,FD38542598,SA00930879,B11,3.88,380,1474.4,15.52,3.17,3.36,4.426,26460,2.4,2022 06 07 18H 19M,Pass,,,,24%,,10/06/2022,zg1/sc45,,,,,Alan Shearer,30,350,0.6x AMPure PB (manual),TRUE,335,201,32.8,45.4,1489.12,130.2,2.04,2.32,27.7,101.0,15665,6.8,2022 06 10 16H 01M,,Pass,,,,,,idMyoMedi1,0.868099,SE293082L,TRUE,,15/06/2022,12.4,,ABORTED - NEW RUN,0.00,FALSE,FALSE,Charge,August 2022,,,
  Production 7,FD20709796,DTOL12931679,,0.54,,,07/06/2022,sc45,Powermash,5.5,Non-plant,2h@25C,FD32230172,,,Yes,FD38542599,SA00930879,C11,1.96,380,744.8,7.84,2.39,2.53,4.617,28533,3.1,2022 06 07 19H 47M,Pass,,,,,,09/06/2022,sc45,,,,,Ed Sheeran,30,345,0.6x AMPure PB (manual),TRUE,360,216,14.4,45.4,653.76,56.6,1.87,1.6,17.24,87.8,12693,6.2,2022 06 09 16H 24M,,Pass,,,,,,idNeoInte1,0.544014,SE293083M,FALSE,PB Fail lib - very low recovery. Not enough for loading (Seq Batch#2),15/06/2022,n/a,,PASS,27.38,FALSE,FALSE,Charge,August 2022,,,
  Production 7,FD20710488,DTOL12931680,,0.65,,,07/06/2022,sc45,Powermash,27.8,Non-plant,2h@25C,FD32230173,,,Yes,FD38542600,SA00930879,D11,8.64,380,3283.2,34.56,1.76,2.45,11.56,32338,3.1,2022 06 07 19H 47M,Pass,,,,,,09/06/2022,sc45,,,,,Ed Sheeran,30,350,0.6x AMPure PB (manual),TRUE,345,207,60.2,45.4,2733.08,239.8,1.88,2.13,57.28,83.2,16569,6.5,2022 06 09 16H 24M,,Pass,,,unusual profile,,,ilAmpOcul1,0.649935,SE293035E,TRUE,,10/06/2022,30.5,,PASS,29.16,FALSE,FALSE,Charge,August 2022,,,
  Production 7,FD20710495,DTOL12931681,,0.67,,,07/06/2022,sc45,Powermash,7.1,Non-plant,2h@25C,FD32230174,,,Yes,FD38542601,SA00930879,E11,2.6,380,988,10.4,2.03,2.75,5.993,28565,2.9,2022 06 07 19H 47M,Pass,,,,,,09/06/2022,sc45,,,,,Ed Sheeran,30,340,0.6x AMPure PB (manual),TRUE,354,212.4,15.5,45.4,703.7,61,2.11,1.65,17.5,71.2,18495,8,2022 06 09 16H 24M,,Pass,,,,,,ilAclKoch1,0.674667,SE293084N,TRUE,,15/06/2022,n/a,,PASS,27.85,FALSE,FALSE,Charge,August 2022,,,
  Production 7,FD20710530,DTOL12931682,,0.40,,,07/06/2022,sc45,Powermash,25.1,Non-plant,2h@25C,FD32230175,,,Yes,FD38542602,SA00930879,F11,3.56,380,1352.8,14.24,2.2,2.63,4.392,21730,1.8,2022 06 07 19H 47M,Pass,,,,,,10/06/2022,zg1/sc45,,,,,Alan Shearer,30,352,0.6x AMPure PB (manual),TRUE,341,204.6,26.4,45.4,1198.56,104.6,1.82,1.88,29.56,88.6,15888,7.3,2022 06 10 17H 28M,,Pass,,,,,,iyAmmPube2,0.40098,SE293085O,TRUE,,15/06/2022,n/a,,PASS,20.80,FALSE,FALSE,Charge,August 2022,,,
  Production 7,FD20710550,DTOL12931683,,1.63,,,07/06/2022,sc45,Powermash,39,Non-plant,2h@25C,FD32230176,,,Yes,FD38542603,SA00930879,G11,7.48,380,2842.4,29.92,1.85,2.5,18.64,30542,2.7,2022 06 07 19H 47M,Pass,,,,em,,10/06/2022,zg1/sc45,,,,,Alan Shearer,30,348,0.6x AMPure PB (manual),TRUE,355,213,57,45.4,2587.8,227,1.84,2.09,30.13,91.0,17756,7.6,2022 06 10 17H 28M,,Pass,,,,,,qqArgBrue1,1.625925,SE293250J,TRUE,,22/06/2022,18.4,,PASS,25.82,FALSE,FALSE,Charge,August 2022,,,
  Production 7,Control (5mil),,,#N/A,,,07/06/2022,sc45,Powermash,NA,Cell Line,2h@25C,FD32230177,,,No,NA,SA00930879,,4.98,380,1892.4,19.92,2.05,3.55,12.45,41098,3.7,2022 06 07 19H 47M,NA (control),,,,CA CGAP-23AAC1,,,,,,,,,,,,,,,,,,,,,,,,,,,,,,,,,,#N/A,CONTROL,TRUE,,,,,Not in WGS,Not in WGS,FALSE,FALSE,No Charge,CONTROL - do not charge,,,
  Production 8,FD20710671,DTOL12931684,,0.83,,,21/06/2022,lk11,Powermash,8.4,Non-plant,2h@25C,FD32230178,,,Yes,FD38542604,SA00930879,H11,5.36,380,2036.8,20.44,1.73,0.8,5.757,38285,4.3,2022 06 21 15H 54M,Pass,,,,,,22/06/2022,sc45,,,,,Alan Shearer,30,353,0.6x AMPure PB (manual),TRUE,326,195.6,32.6,45.4,1480.04,129.4,1.89,1.94,34.93,72.7,16584,8,2022 06 23 17H 26M,,Pass,,,Qubit tubes were used rather then Axygen tubes.,,,ilPamAuri1,0.833,SE293442P,TRUE,,28/06/2022,14.4,,PASS,29.44,FALSE,FALSE,Charge,August 2022,,,
  Production 8,FD20710726,DTOL12931685,,0.40,,,21/06/2022,lk11,Powermash,8.6,Non-plant,2h@25C,FD32230179,,,Yes,FD38542605,SA00930879,A12,5.22,380,1983.6,19.88,2.03,1.42,13.75,30828,2.9,2022 06 21 15H 54M,Pass,,,,,,22/06/2022,sc45,,,,,Alan Shearer,30,350,0.6x AMPure PB (manual),TRUE,334,200.4,28,45.4,1271.2,111,2.12,1.54,43.93,64.1,16945,7,2022 06 23 17H 26M,,Pass,,,Qubit tubes were used rather then Axygen tubes (standards done with Axygen).,,,ilAcaVire1,0.403289,SE293479F,TRUE,Michelle tried a modified SPRI and got a nice profile as a result,05/07/2022,n/a,,PASS,22.35,FALSE,FALSE,Charge,August 2022,,,
  Production 8,FD20710747,DTOL12931686,,0.40,,,21/06/2022,lk11,Powermash,10.2,Non-plant,2h@25C,FD32230180,,,Yes,FD38542606,SA00930879,B12,2.32,380,881.6,8.28,-4.96,-0.98,1.267,36657,3.7,2022 06 21 15H 54M,Pass,,,,,,22/06/2022,sc45,,,,,Alan Shearer,30,356,0.6x AMPure PB (manual),TRUE,352,211.2,16.4,45.4,744.56,64.6,1.95,1.96,17.46,84.5,14974,7.5,2022 06 23 17H 26M,,Pass,,,"RE-FEMTO (EM27) done - HMW smear. Re-ran 2022 06 30 14H 33M, and still shows HMW smear. Qubit tubes were used rather then Axygen tubes.",,,ilEleCory1,0.403289,SE297136B,TRUE,,25/08/2022,10,,PASS,28.20,FALSE,FALSE,Charge,August 2022,2022 06 30 14H 33M,15309,7.9
  Production 10,FF06104458,DTOL12931687,,1.39,FH00320849,A2,04/07/2022,lk11/mf21,Cryoprep,95,Non-plant,2h@25C,FF06104458,,,Yes,FD38542650,SA01034044,F5,1.57,380,596.6,5.28,1.72,1.21,4.35,49808,3.9,2022 07 04 16H 39M,Pass,,,,,,05/07/2022,lk11/mf21,,,,,Ed Sheeran,30,365,0.6x AMPure PB (manual),TRUE,350,210,7.72,46,355.12,29.88,1.72,0.79,20.61,59.5,10000,4.5,2022 07 11 10H 18M,,Fail,,,fail on concentration,,Submit to Lib Prep,qxDreNegl1,1.389371,SE307364S,TRUE,chased with Lucy & carlos 10/11/22 (hb16),16/11/2022,n/a,,Not in WGS,Not in WGS,FALSE,FALSE,Charge,August 2022,,,
  Production 8,FF10128606,DTOL12931688,,0.22,,,21/06/2022,lk11,Cryoprep,40,Non-plant,2h@25C,FD32230181,,,Yes,FD38542607,SA00930879,C12,2.38,380,904.4,8.52,2.26,0.53,5.653,55451,5.2,2022 06 21 15H 54M,Pass,,,,,,22/06/2022,sc45,,,,,Alan Shearer,30,356,0.6x AMPure PB (manual),TRUE,340,204,15,45.4,681,59,1.91,1.18,21.97,75.3,16807,8.4,2022 06 23 17H 26M,,Pass,,,Qubit tubes were used rather then Axygen tubes.,,,iyAmbProt1,0.219,SE293443Q,TRUE,,28/06/2022,n/a,,PASS,23.11,FALSE,FALSE,Charge,August 2022,,,
  Production 8,FF10128668,DTOL12931689,,0.44,,,21/06/2022,lk11,Cryoprep,47,Non-plant,2h@25C,FD32230182,,,Yes,FD38542608,SA00930879,D12,6.08,380,2310.4,23.32,1.49,0.95,7.511,53571,5.4,2022 06 21 15H 54M,Pass,,,,,,22/06/2022,sc45,,,,,Alan Shearer,30,356,0.6x AMPure PB (manual),TRUE,342,205.2,39.8,45.4,1806.92,158.2,1.92,2.07,41.03,78.2,16919,8.4,2022 06 23 17H 26M,,Pass,,,Qubit tubes were used rather then Axygen tubes.,,,ilAcrPsix1,0.437,SE293444R,TRUE,,28/06/2022,15.2,,PASS,22.12,FALSE,FALSE,Charge,August 2022,,,
  Production 8,FF10128746,DTOL12931690,,0.39,,,21/06/2022,lk11,Cryoprep,45.3,Non-plant,2h@25C,FD32230183,,,Yes,FD38542609,SA00930879,E12,4.94,380,1877.2,18.76,1.93,1.38,6.236,47079,4.8,2022 06 21 15H 54M,Pass,,,,,,22/06/2022,sc45,,,,,Alan Shearer,30,357,0.6x AMPure PB (manual),TRUE,333,199.8,33.4,45.4,1516.36,132.6,1.95,1.81,37.08,80.8,16194,8.2,2022 06 23 17H 26M,,Pass,,,Qubit tubes were used rather then Axygen tubes.,,,ilAbrTril1,0.386,SE293445S,TRUE,,28/06/2022,13.9,,PASS,16.25,FALSE,FALSE,Charge,August 2022,,,
  Production 8,FS05286724,DTOL12931691,,2.43,,,21/06/2022,lk11,Powermash,33,Non-plant,2h@25C,FD32230184,,,Yes,FD38542610,SA00930879,F12,7.24,380,2751.2,27.96,1.84,3.41,8.824,31275,2.9,2022 06 21 15H 54M,Pass,,,,,,22/06/2022,sc45,,,,,Alan Shearer,30,359,0.6x AMPure PB (manual),TRUE,333,199.8,49,45.4,2224.6,195,1.82,2.14,52.85,80.9,18145,6.6,2022 06 30 14H 33M,,Pass,,,RE-FEMTO (EM27) - done; link of new run added to column BD. (originally ran in 2022 06 23 17H 26M- low amplitude peak). Qubit tubes were used rather then Axygen tubes.,,,qqAraAngu1,2.42544,SE293532Q,TRUE,pass during meeting,05/07/2022,20.7,,PASS,16.79,FALSE,FALSE,Charge,August 2022,2022 06 30 14H 33M,18018,6.8
  Production 8,FS05287139,DTOL12931692,,2.81,,,21/06/2022,lk11,Powermash,5,Non-plant,2h@25C,FD32230185,,,Yes,FD38542611,SA00930879,G12,5.24,380,1991.2,19.96,2.31,16.16,5.816,45293,4.7,2022 06 21 15H 54M,Pass,,,,,,22/06/2022,sc45,,,,,Alan Shearer,30,353,0.6x AMPure PB (manual),TRUE,340,204,36.4,45.4,1652.56,144.6,1.91,2.06,38.57,83.0,17365,7.9,2022 06 23 18H 53M,,Pass,,,Qubit tubes were used rather then Axygen tubes.,,,qqEnoOvat1,2.80686,SE293446T,TRUE,,28/06/2022,16.7,,PASS,19.25,FALSE,FALSE,Charge,August 2022,,,
  Production 8,FS05304269,DTOL12948839,,0.42,,,21/06/2022,lk11,Powermash,24.2,Non-plant,2h@25C,FD32230186,,,Yes,FD38542612,SA00930879,H12,5.18,380,1968.4,19.72,1.62,1.46,6.818,43875,4.3,2022 06 21 15H 54M,Pass,,,,,,22/06/2022,sc45,,,,,Ed Sheeran,30,355,0.6x AMPure PB (manual),TRUE,332,199.2,28.2,45.4,1280.28,111.8,1.75,1.25,40.36,65.0,14735,7.6,2022 06 23 18H 53M,,Pass,,,Qubit tubes were used rather then Axygen tubes.,,,idVilMode1,0.422,SE293447U,TRUE,,28/06/2022,13.6,,PASS,25.63,FALSE,FALSE,Charge,August 2022,,,
  Production 8,FD20709774,DTOL12948840,,0.53,,,21/06/2022,lk11,Powermash,17.8,Non-plant,2h@25C,FD32230187,,,Yes,FD38542613,SA01034044,A1,3.28,380,1246.4,12.12,1.67,1.13,3.062,39987,3.4,2022 06 21 15H 54M,Pass,,,,,,22/06/2022,sc45,,,,,Ed Sheeran,30,357,0.6x AMPure PB (manual),TRUE,319,191.4,14.8,45.4,671.92,58.2,2.69,2.16,13.78,53.9,15166,7.1,2022 06 23 18H 53M,,Pass,,,Qubit tubes were used rather then Axygen tubes.,,,iyNomRufi2,0.526649,SE293448V,TRUE,,28/06/2022,n/a,,PASS,12.32,FALSE,FALSE,Charge,August 2022,,,
  Production 8,FD20709675,DTOL12948841,,0.53,,,21/06/2022,lk11,Powermash,6.9,Non-plant,2h@25C,FD32230188,,,Yes,FD38542614,SA01034044,B1,2.12,380,805.6,7.48,19.67,-1.23,1.115,41581,4.4,2022 06 21 15H 54M,Pass,,,,,,23/06/2022,fs17,,,,,Alan Shearer,30,360,0.6x AMPure PB (manual),TRUE,342,205.2,12.2,45.4,553.88,47.8,2,1.71,12.81,68.8,16505,8.1,2022 06 23 18H 53M,,Pass,,,,,,iyNomFlao1,0.526649,SE293449W,TRUE,,28/06/2022,n/a,,Not in WGS,Not in WGS,FALSE,FALSE,Charge,August 2022,,,
  Production 8,FD20706853,DTOL12948842,,0.39,,,21/06/2022,lk11,Powermash,3.1,Non-plant,2h@25C,FD32230189,,,Yes,FD38542615,SA01034044,C1,2,380,760,7,1.2,0.87,3.854,55542,5.4,2022 06 21 17H 23M,Pass,,,,,,23/06/2022,fs17,,,,,Alan Shearer,30,360,0.6x AMPure PB (manual),TRUE,345,207,12.3,45.4,558.42,48.2,2.09,2.27,12.09,73.5,14831,8.2,2022 06 23 18H 53M,,Pass,,,,,,ilEspSulp1,0.389333,SE293450P,TRUE,,28/06/2022,n/a,,PASS,32.05,FALSE,FALSE,Charge,August 2022,,,
  Production 8,FD20706749,DTOL12948843,,0.51,,,21/06/2022,sc45,Powermash,6.4,Non-plant,2h@25C,,,,Yes,FD38542616,SA01034044,D1,0.812,380,308.56,2.248,-0.23,0.53,-0.2544,50633,5.1,2022 06 21 17H 23M,On Hold ULI,,,,excellent femto profile; Low yield,,21/09/2022,mls,,,,,G-tube,,,,,,,3.1,46,142.6,,,,,46.2,8274,1.4,2022 09 21 12H 49M,,Pass,,,,22/09/2022,Proceed with ULI,idEmpSter1,0.5105,SE300162F,TRUE,,22/09/2022,54.9,,PASS,25.63,FALSE,FALSE,Charge,August 2022,,,
  Production 8,FD20710399,DTOL12948844,,0.49,,,21/06/2022,sc45,Powermash,30.6,Non-plant,2h@25C,FD32230191,,,Yes,FD38542617,SA01034044,E1,1.85,380,703,6.4,1.39,1.05,0.7587,46266,4.3,2022 06 21 17H 23M,Pass,,,,,,23/06/2022,fs17,,,,,Alan Shearer,30,360,0.6x AMPure PB (manual),TRUE,346,207.6,12.4,45.4,562.96,48.6,1.9,1.51,14.44,80.1,14257,7.5,2022 06 23 18H 53M,,Pass,,,,,,ilEupDodo1,0.491,SE293451Q,TRUE,,28/06/2022,n/a,,PASS,21.35,FALSE,FALSE,Charge,August 2022,,,
  Production 8,FD20706436,DTOL12948845,,0.40,,,21/06/2022,sc45,Powermash,11.5,Non-plant,2h@25C,FD32230192,,,Yes,FD38542618,SA01034044,F1,4.28,380,1626.4,16.12,1.86,1.36,6.401,25040,1.8,2022 06 21 17H 23M,Pass,,,,18% above 30kb,,23/06/2022,fs17,,,,,Alan Shearer,30,360,0.6x AMPure PB (manual),TRUE,348,208.8,27.8,45.4,1262.12,110.2,2.03,2.01,27.36,77.6,15118,5.9,2022 06 23 18H 53M,,Pass,,,,,,ilGanPyra1,0.403289,SE293452R,TRUE,,28/06/2022,n/a,,PASS,10.12,FALSE,FALSE,Charge,August 2022,,,
  Production 8,FD20706789,DTOL12948846,,0.58,,,21/06/2022,sc45,Powermash,8.9,Non-plant,2h@25C,FD32230193,,,Yes,FD38542619,SA01034044,G1,3.32,380,1261.6,12.28,1.7,1.19,12.78,69283,5.2,2022 06 21 17H 23M,Pass,,,,,,23/06/2022,fs17,,,,,Alan Shearer,30,355,0.6x AMPure PB (manual),TRUE,342,205.2,18.4,45.4,835.36,72.6,1.92,1.55,22.64,66.2,17753,8,2022 06 23 18H 53M,,Pass,,,,,,ihHarThor1,0.57702,SE293453S,TRUE,,28/06/2022,n/a,,Not in WGS,Not in WGS,FALSE,FALSE,Charge,August 2022,,,
  Production 8,FD20706757,DTOL12948847,,0.24,,,21/06/2022,sc45,Powermash,11.1,Non-plant,2h@25C,FD32230194,,,Yes,FD38542620,SA01034044,H1,1.94,380,737.2,6.76,2.25,4.19,4.774,52670,3.8,2022 06 21 17H 23M,Pass,,,,,,23/06/2022,fs17,,,,,Alan Shearer,30,355,0.6x AMPure PB (manual),TRUE,340,204,9.54,45.4,433.116,37.16,2,1.01,16.06,58.8,16935,7.4,2022 06 23 18H 53M,,Pass,,,let's try! (em27),,,icLeiOopt1,0.239,SE293454T,TRUE,,28/06/2022,n/a,,Not in WGS,Not in WGS,FALSE,FALSE,Charge,August 2022,,,
  Production 8,FS05287135,DTOL12948848,,0.87,,,21/06/2022,sc45,Powermash,9.2,Non-plant,2h@25C,FD32230195,,,Yes,FD38542621,SA01034044,A2,4.02,380,1527.6,15.08,2.11,5.65,4.032,27482,2.7,2022 06 21 17H 23M,Pass,,,,,,23/06/2022,fs17,,,,,Ed Sheeran,30,360,0.6x AMPure PB (manual),TRUE,346,207.6,26.2,45.4,1189.48,103.8,2.03,1.79,28.82,77.9,16887,6.5,2022 06 23 18H 53M,,Pass,,,,,,idLisNana1,0.868405,SE293455U,TRUE,,28/06/2022,n/a,,PASS,20.35,FALSE,FALSE,Charge,August 2022,,,
  Production 8,FD20709664,DTOL12948849,,0.67,,,21/06/2022,sc45,Powermash,8.7,Non-plant,2h@25C,FD32230196,fk00223822,A3,Yes,FD38542622,SA01034044,B2,3.8,380,1444,14.2,2.07,2.3,4.993,27383,2.8,2022 06 21 17H 23M,Pass,,,,,,23/06/2022,fs17,,,,,Ed Sheeran,30,365,0.6x AMPure PB (manual),TRUE,352,211.2,25,45.4,1135,99,2.2,3.74,22.04,78.6,13731,6.9,2022 06 23 18H 53M,,Pass,,,,,,idLypDubi1,0.668,SE293456V,TRUE,,28/06/2022,11.6,,PASS,18.59,FALSE,FALSE,Charge,August 2022,,,
  Production 8,FD20706537,DTOL12948850,,0.53,,,21/06/2022,sc45,Powermash,18.5,Non-plant,2h@25C,FD32230197,,,Yes,FD38542623,SA01034044,C2,3.38,380,1284.4,12.52,2.17,2.08,5.992,29507,3.2,2022 06 21 17H 23M,Pass,,,,,,23/06/2022,fs17,,,,,Ed Sheeran,30,358,0.6x AMPure PB (manual),TRUE,344,206.4,21.2,45.4,962.48,83.8,1.9,1.93,21.55,74.9,16871,7.5,2022 06 23 20H 21M,,Pass,,,,,,iyNomHirt1,0.526649,SE293457W,TRUE,,28/06/2022,n/a,,PASS,29.47,FALSE,FALSE,Charge,August 2022,,,
  Production 8,FS05287083,DTOL12948851,,1.41,,,21/06/2022,sc45,Powermash,18.1,Non-plant,2h@25C,FD32230198,fk00223822,D2,Yes,FD38542624,SA01034044,D2,8.86,380,3366.8,34.44,1.64,1.24,18.06,6507,0,2022 06 21 17H 23M,Fail,,,,"Poor profile, peak at ~6000",,,,,,,,,,,,FALSE,,,,,,,,,,,,,,,,,,,,,idOchRust1,1.407342,,TRUE,,,,,Not in WGS,Not in WGS,FALSE,FALSE,Charge,August 2022,,,
  Production 8,FS05287025,DTOL12948852,,1.06,,,21/06/2022,sc45,Powermash,5.8,Non-plant,2h@25C,FD32230199,,,Yes,FD38542625,SA01034044,E2,1.51,380,573.8,5.04,0.84,0.24,-0.08929,41532,4.1,2022 06 21 17H 23M,Pass,,,,,,23/06/2022,fs17,,,,,Ed Sheeran,30,360,0.6x AMPure PB (manual),TRUE,346,207.6,9.26,45.4,420.404,36.04,2.61,1.96,8.7,73.3,17167,7.4,2022 06 23 20H 21M,,Pass,,,let's try! (em27),,,idNemPant1,1.06402,SE293458A,TRUE,,28/06/2022,n/a,,Not in WGS,Not in WGS,FALSE,FALSE,Charge,August 2022,,,
  Production 8,FD20710575,DTOL12948853,,1.06,,,21/06/2022,sc45,Powermash,12.9,Non-plant,2h@25C,FD32230200,,,Yes,FD38542626,SA01034044,F2,4.5,380,1710,17,2.71,4.75,4.159,44068,4.4,2022 06 21 18H 51M,Pass,,,,,,23/06/2022,fs17,,,,,Ed Sheeran,30,360,0.6x AMPure PB (manual),TRUE,348,208.8,28.8,45.4,1307.52,114.2,1.92,1.8,27.99,76.5,17404,7.8,2022 06 23 20H 21M,,Pass,,,,,,idOxyRara1,1.06402,SE293459B,TRUE,,28/06/2022,14,,PASS,13.20,FALSE,FALSE,Charge,August 2022,,,
  Production 8,Control (5mil),,,#N/A,,,21/06/2022,sc45,Powermash,NA,Cell Line,2h@25C,FD32230201,Rack 1,,No,N/A,,,4.6,380,1748,17.4,2,3.44,6.771,53866,5.4,2022 06 21 18H 51M,NA (control),,,,CA CGAP-23AAD0 #5,,,,,,,,,,,,,,,,,,,,,,0.0,,,,,,,,,,,,#N/A,CONTROL,TRUE,,,,,Not in WGS,Not in WGS,FALSE,FALSE,No Charge,CONTROL - do not charge,,,
  Production 9,FD20710594,DTOL12948854,,1.06,,,28/06/2022,fs17,Powermash,5.2,Non-plant,2h@25C,FD32230202,,,Yes,FD38542627,SA01034044,G2,3.72,380,1413.6,13.88,1.8,2.71,3.885,33272,4.2,2022 06 28 15H 53M,Pass,,,,,,29/06/2022,fs17,,,,,Alan Shearer,30,355,0.6x AMPure PB (manual),TRUE,340,204,28.6,45.4,1298.44,113.4,2.01,1.57,25.7,91.9,14959,8.6,2022 06 30 14H 33M,,Pass,,,,,,idPacAtra1,1.06402,SE293538W,TRUE,,05/07/2022,n/a,,PASS,23.18,FALSE,FALSE,Charge,August 2022,,,
  Production 9,FS05287079,DTOL12948855,,1.06,,,28/06/2022,fs17,Powermash,6.4,Non-plant,2h@25C,FD32230203,fk00223822,A10,Yes,FD38542628,SA01034044,H2,3.72,380,1413.6,13.88,4.01,24.07,3.021,40145,4.3,2022 06 28 15H 53M,Pass,,,,,,29/06/2022,fs17,,,,,Alan Shearer,30,360,0.6x AMPure PB (manual),TRUE,342,205.2,27,45.4,1225.8,107,1.98,2.15,21.94,86.7,15367,8.2,2022 06 30 14H 33M,,Pass,,,,,,idNemNigr1,1.06402,SE293539A,TRUE,,05/07/2022,n/a,,PASS,28.91,FALSE,FALSE,Charge,August 2022,,,
  Production 9,FR25746576,DTOL12948856,,0.42,,,28/06/2022,fs17,Powermash,10.5,Non-plant,2h@25C,FD32230204,Rack 1,,Yes,FD38542629,SA01034044,A3,1.02,380,387.6,3.08,1.31,-0.06,0.7408,13663,0.6,2022 06 28 15H 53M,Fail,,,,,,,,,,,,,,,,FALSE,,,,,,,,,,,,,,,,,,,,,qdPolCori2,0.42054,,TRUE,,,,,Not in WGS,Not in WGS,FALSE,FALSE,Charge,August 2022,,,
  Production 9,FD20710620,DTOL12948857,,0.44,,,28/06/2022,fs17,Powermash,0.01,Non-plant,2h@25C,FD32230205,,,Yes,FD38542630,SA01034044,B3,1.08,380,410.4,3.32,1.45,-0.72,0.5525,49758,5.1,2022 06 28 15H 53M,Pass,,,,borderline concentration (410),,29/06/2022,fs17,,,,,Alan Shearer,30,360,0.6x AMPure PB (manual),TRUE,335,201,9.98,45.4,453.092,38.92,2.95,2,6.202,110.4,14492,8.6,2022 06 30 14H 33M,,Pass,,,"let's review after the ""let's try"" ones; good profile, low yield *fs). Low yield so failed 12/08/2022",,,qdPolLagu2,0.44346,SE297137C,TRUE,,25/08/2022,n/a,,Not in WGS,Not in WGS,FALSE,FALSE,Charge,August 2022,,,
  Production 9,FF09868018,DTOL12948858,,14.84,,,28/06/2022,fs17,Powermash,29.1,Non-plant,2h@25C,FD32230206,,,Yes,FD38542631,SA01034044,C3,2.02,380,767.6,7.08,3.31,-0.54,3.346,28882,2.9,2022 06 28 15H 53M,Pass,,,,,,29/06/2022,fs17,,,,,Ed Sheeran,30,360,0.6x AMPure PB (manual),TRUE,350,210,14,45.4,635.6,55,2.13,1.63,11.38,82.8,15134,7.7,2022 06 30 14H 33M,,Pass,,,,,,qmLioPusi1,14.83626,SE294641B,TRUE,,05/08/2022,n/a,,PASS,12.07,FALSE,FALSE,Charge,August 2022,,,
  Production 9,FD20706851,DTOL12948859,,0.38,,,28/06/2022,fs17,Powermash,2.2,Non-plant,2h@25C,FD32230207,,,Yes,FD38542632,SA01034044,D3,3.9,380,1482,14.6,1.92,2.34,4.539,27187,2.8,2022 06 28 15H 53M,Pass,,,,,,29/06/2022,fs17,,,,,Ed Sheeran,30,360,0.6x AMPure PB (manual),TRUE,332,199.2,26.6,45.4,1207.64,105.4,2.1,1.83,22.65,81.5,15075,7.7,2022 06 30 14H 33M,,Pass,,,,,,ilIncMasc1,0.37653,SE293540Q,TRUE,,05/07/2022,n/a,,PASS,21.80,FALSE,FALSE,Charge,August 2022,,,
  Production 9,FD20709390,DTOL12948860,,0.83,,,28/06/2022,fs17,Powermash,4.1,Non-plant,2h@25C,FD32230208,,,Yes,FD38542633,SA01034044,E3,4.16,380,1580.8,15.64,2.89,5.29,3.732,40593,4.3,2022 06 28 15H 53M,Pass,,,,,,29/06/2022,sc45,,,,,Ed Sheeran,30,363,0.6x AMPure PB (manual),TRUE,318,190.8,23,45.4,1044.2,91,2.21,1.89,20.8,66.1,16400,8.1,2022 06 30 16H 01M,,Pass,,,,,,ilPamGiga1,0.833,SE293541R,TRUE,,05/07/2022,n/a,,Not in WGS,Not in WGS,FALSE,FALSE,Charge,August 2022,,,
  Production 9,FS05287068,DTOL12948861,,1.06,,,28/06/2022,fs17,Powermash,0.1,Non-plant,2h@25C,FD32230209,,,Yes,FD38542634,SA01034044,F3,2.46,380,934.8,8.84,2.68,-6.45,2.793,43368,4.5,2022 06 28 15H 53M,Pass,,,,,,29/06/2022,sc45,,,,,Ed Sheeran,30,356,0.6x AMPure PB (manual),TRUE,335,201,13.6,45.4,617.44,53.4,2.05,1.99,13.8,66.1,17600,8,2022 06 30 16H 01M,,Pass,,,,,,idOxyPygm1,1.06402,SE293542S,TRUE,,05/07/2022,n/a,,Not in WGS,Not in WGS,FALSE,FALSE,Charge,August 2022,,,
  Production 9,FS05287124,DTOL12948862,,1.97,,,28/06/2022,fs17,Powermash,32.9,Non-plant,2h@25C,FD32230210,,,Yes,FD38542635,SA01034044,G3,10,380,3800,39,1.92,2.29,17.17,25771,2.5,2022 06 28 17H 45M,Pass,,,,,,29/06/2022,sc45,,,,,Ed Sheeran,30,358,0.6x AMPure PB (manual),TRUE,340,204,46,45.4,2088.4,183,1.89,2.04,46.67,55.0,13551,7.1,2022 06 30 16H 01M,,Pass,,,,,,icOtiAtro1,1.97248,SE293543T,TRUE,,05/07/2022,n/a,,PASS,18.62,FALSE,FALSE,Charge,August 2022,,,
  Production 9,FD20706482,DTOL12948863,,0.61,,,28/06/2022,fs17,Powermash,4.3,Non-plant,2h@25C,FD32230211,,,Yes,FD38542636,SA01034044,H3,2.26,380,858.8,8.04,3.84,18.47,4.133,25442,2.2,2022 06 28 17H 45M,Pass,,,,,,29/06/2022,sc45,,,,,Ed Sheeran,30,357,0.6x AMPure PB (manual),TRUE,344,206.4,8,45.4,363.2,31,2.09,1.39,14.63,42.3,15900,7.6,2022 06 30 16H 01M,,Fail,,,,,Submit to Lib Prep,icMalFlav1,0.60825,SE302056M,TRUE,,27/09/2022,n/a,,PASS,29.09,FALSE,FALSE,Charge,August 2022,,,
  Production 9,FB01533769,DTOL12948864,,0.66,,,28/06/2022,fs17,Powermash,22,Non-plant,2h@25C,FD32230212,,,Yes,FD38542637,SA01034044,A4,8.9,380,3382,34.6,1.93,1.59,14.41,22656,2.1,2022 06 28 17H 45M,Pass,,,,,,29/06/2022,sc45,,,,,Ed Sheeran,30,361,0.6x AMPure PB (manual),TRUE,355,213,53.6,45.4,2433.44,213.4,1.89,1.63,61.57,72.0,16200,7.7,2022 06 30 16H 01M,,Pass,,,,,,ioLibQuad1,0.65526,SE293544U,TRUE,,05/07/2022,22.6,,PASS,22.56,FALSE,FALSE,Charge,August 2022,,,
  Production 9,FD20710460,DTOL12948865,,0.67,,,28/06/2022,fs17,Powermash,5,Non-plant,2h@25C,FD32230213,,,Yes,FD38542638,SA01034044,B4,5,380,1900,19,1.85,2.47,10.82,33781,3.7,2022 06 28 17H 45M,Pass,,,,,,29/06/2022,sc45,,,,,Ed Sheeran,30,349,0.6x AMPure PB (manual),TRUE,347,208.2,26.2,45.4,1189.48,103.8,2.13,1.88,27.74,62.6,16950,8.5,2022 06 30 16H 01M,,Pass,,,,,,ilMonLaev1,0.666,SE293545V,TRUE,,05/07/2022,11.7,,PASS,29.32,FALSE,FALSE,Charge,August 2022,,,
  Production 9,FD20710618,DTOL12948866,,0.94,,,28/06/2022,sc45,Powermash,10.6,Non-plant,2h@25C,FD32230214,,,Yes,FD38542639,SA01034044,C4,8.5,380,3230,33,1.91,1.59,14.78,14605,0.5,2022 06 28 17H 45M,Pass,,,,"suboptimal profile, but let's try (3230ng) ; shear on w/c 4/7 and monitor results",,29/06/2022,sc45,,,,,Alan Shearer,30,355,0.6x AMPure PB (manual),TRUE,355,213,42.8,45.4,1943.12,170.2,1.93,1.04,40.49,60.2,9696,3.9,2022 07 04 16H 39M,,Pass,,,??? em27 peak at 9600Kb. (60% below 10kb). Boarderline. Passed as small genome size: 0.6Gb,,,icAgrCyan1,0.943073,SE295942P,TRUE,,19/08/2022,21.4,,PASS,18.18,FALSE,FALSE,Charge,August 2022,,,
  Production 9,FD20706680,DTOL12948867,,0.87,,,28/06/2022,sc45,Powermash,3.3,Non-plant,2h@25C,FD32230215,fk00223822,B4,Yes,FD38542640,SA01034044,D4,8.26,380,3138.8,32.04,1.79,1.83,10.78,7109,0,2022 06 28 17H 45M,Failed Profile,,,,"""sharp"" peak at 7303bp",,,,,,,,,,,,FALSE,,,,,,,,,,,,,,,,,,,,,icAgrAngu1,0.87322,,TRUE,,,,,Not in WGS,Not in WGS,FALSE,FALSE,Charge,August 2022,,,
  Production 9,FD20706683,DTOL12948868,,0.64,,,28/06/2022,sc45,Powermash,23.7,Non-plant,2h@25C,FD32230216,fk00223822,B9,Yes,FD38542641,SA01034044,E4,7.88,380,2994.4,30.52,2.08,2.34,34.92,12366,0.3,2022 06 28 17H 45M,Failed Profile,,,,,,,,,,,,,,,,FALSE,,,,,,,,,,,,,,,,,,,,,icAgoVidu1,0.641073,,TRUE,,,,,Not in WGS,Not in WGS,FALSE,FALSE,Charge,August 2022,,,
  Production 9,FD20710627,DTOL12948869,,0.64,,,28/06/2022,sc45,Powermash,2.8,Non-plant,2h@25C,FD32230217,,,Yes,FD38542642,SA01034044,F4,1.81,380,687.8,6.24,3.2,5.94,2.494,28765,2.5,2022 06 28 17H 45M,Pass,,,,,,29/06/2022,sc45,,,,,Britney Shears,30,360,0.6x AMPure PB (manual),TRUE,341,204.6,9.24,45.4,419.496,35.96,1.94,1.07,13.81,61.0,14850,6.6,2022 06 30 16H 01M,,Fail,,,borderline? shoulder of shorter fragments (32% between 1 and 10kb). Failed on yield 01/08/2022,,Submit to Lib Prep,icAsaCurt1,0.642073,SE302057N,TRUE,,27/09/2022,n/a,,PASS,26.40,FALSE,FALSE,Charge,August 2022,,,
  Production 9,FD20710490,DTOL12948870,,0.62,,,28/06/2022,sc45,Powermash,29,Non-plant,2h@25C,FD32230218,,,Yes,FD38542643,SA01034044,G4,7.6,380,2888,29.4,1.66,1.82,9.433,42257,4.1,2022 06 28 17H 45M,Pass,,,,,,29/06/2022,sc45,,,,,Britney Shears,30,355,0.6x AMPure PB (manual),TRUE,349,209.4,43,45.4,1952.2,171,1.87,1.96,42.98,67.6,16200,7.7,2022 06 30 16H 01M,,Pass,,,,,,ilArcCraa1,0.62,SE293546W,TRUE,,05/07/2022,16.6,,PASS,25.80,FALSE,FALSE,Charge,August 2022,,,
  Production 9,FD20710473,DTOL12955855,,0.72,,,28/06/2022,sc45,Powermash,9.4,Non-plant,2h@25C,FD32230219,,,Yes,FD38542644,SA01034044,H4,7.56,380,2872.8,29.24,2.17,1.72,9.304,28145,2.4,2022 06 28 17H 45M,Pass,,,,,,29/06/2022,sc45,,,,,Britney Shears,30,353,0.6x AMPure PB (manual),TRUE,354,212.4,40.6,45.4,1843.24,161.4,2.06,2.12,40.99,64.2,16750,7.3,2022 06 30 16H 01M,,Pass,,,,,,ilApoCapr1,0.716,SE293547A,TRUE,,05/07/2022,18.6,,PASS,27.26,FALSE,FALSE,Charge,August 2022,,,
  Production 9,FD20706625,DTOL12955856,,0.58,,,28/06/2022,sc45,Powermash,17,Non-plant,2h@25C,FD32230220,,,Yes,FD38542645,SA01034044,A5,5.54,380,2105.2,21.16,2,1.3,12.44,25897,1.9,2022 06 28 17H 45M,Pass,,,,,,29/06/2022,sc45,,,,,Alan Shearer,30,369,0.6x AMPure PB (manual),TRUE,341,204.6,27.6,45.4,1253.04,109.4,1.95,1.31,34.2,59.5,13927,6.8,2022 07 04 16H 39M,,Pass,,,,,,ilApoBist1,0.582662,SE293622R,TRUE,,12/07/2022,n/a,,PASS,29.95,FALSE,FALSE,Charge,August 2022,,,
  Production 9,FD20706773,DTOL12955857,,0.60,,,28/06/2022,sc45,Powermash,2.3,Non-plant,2h@25C,FD32230221,,,Yes,FD38542646,SA01034044,B5,3.76,380,1428.8,14.04,1.68,3.8,3.776,20827,1.8,2022 06 28 21H 05M,Pass,,,,,,29/06/2022,sc45,,,,,Alan Shearer,30,370,0.6x AMPure PB (manual),TRUE,356,213.6,22,45.4,998.8,87,2.01,2.01,20.64,69.9,13468,6.5,2022 07 04 16H 39M,,Pass,,,,,,ilAntFabr1,0.600553,SE293623S,TRUE,,12/07/2022,n/a,,FAIL,0.01,FALSE,FALSE,Charge,August 2022,,,
  Production 9,FD20706892,DTOL12955858,,1.11,,,28/06/2022,sc45,Powermash,3.4,Non-plant,2h@25C,FD32230222,fk00223822,C4,Yes,FD38542647,SA01034044,C5,7.08,380,2690.4,27.32,1.91,2,10.96,12627,0.7,2022 06 28 21H 05M,Failed Profile,,,,peak ~2500bp,,,,,,,,,,,,FALSE,,,,,,,,,,,,,,,,,,,,,idAntProc1,1.11047,,TRUE,,,,,Not in WGS,Not in WGS,FALSE,FALSE,Charge,August 2022,,,
  Production 9,FD20710700,DTOL12955859,,1.26,,,28/06/2022,sc45,Powermash,4.4,Non-plant,2h@25C,FD32230223,,,Yes,FD38542648,SA01034044,D5,3.44,380,1307.2,12.76,2.04,1.92,11.5,32784,2.9,2022 06 28 21H 05M,Pass,,,,,,29/06/2022,sc45,,,,,Alan Shearer,30,368,0.6x AMPure PB (manual),TRUE,348,208.8,16.9,45.4,767.26,66.6,1.95,1.42,20.64,58.7,14182,7.7,2022 07 04 16H 39M,,Pass,,,,,,icAntRufu1,1.26162,SE293624T,TRUE,,12/07/2022,n/a,,FAIL INSTRUMENT,11.47,FALSE,FALSE,Charge,August 2022,,,
  Production 9,FD20706672,DTOL12955860,,0.40,,,28/06/2022,sc45,Powermash,0.01,Non-plant,2h@25C,FD32230224,,,Yes,FD38542649,SA01034044,E5,1.08,380,410.4,3.32,-0.43,-0.37,0.3501,36998,4.9,2022 06 28 21H 05M,Pass,,,,,,29/06/2022,sc45,,,,,Alan Shearer,30,370,0.6x AMPure PB (manual),TRUE,360,216,5.64,45.4,256.056,21.56,3.13,1.96,4.993,62.4,14437,7.9,2022 07 04 16H 39M,,Fail,,,,,Direct to ULI,icAntAnth1,0.40098,SE300143C,TRUE,,21/09/2022,n/a,,Not in WGS,Not in WGS,FALSE,FALSE,Charge,August 2022,,,
  Production 9,Control (5mil),,,#N/A,,,28/06/2022,sc45,Powermash,NA,Cell Line,2h@25C,FD32230225,Rack 1,,No,N/A,,NA,4.66,380,1770.8,17.64,1.9,4.06,7.847,33999,3.5,2022 06 28 21H 05M,NA (control),,,,CA CGAP-23AC43 $GM24385,,,,,,,,,,,,,,,,,,,,,,0.0,,,,,,,,,,,,#N/A,CONTROL,TRUE,,,,,Not in WGS,Not in WGS,FALSE,FALSE,No Charge,CONTROL - do not charge,,,
  Production 10,FD20710608,DTOL12955861,,0.80,,,04/07/2022,lk11/mf21,Powermash,3.4,Non-plant,2h@25C,FD20710608,,,Yes,FD38542651,SA01034044,G5,1.29,380,490.2,4.16,1.16,1.57,1.55,38604,3.8,2022 07 04 16H 39M,Pass,,,,,,05/07/2022,lk11/mf21,,,,,Ed Sheeran,30,365,0.6x AMPure PB (manual),TRUE,345,207,6.02,46,276.92,23.08,2.11,1.34,9.28,56.5,14053,7.2,2022 07 11 10H 18M,,Fail,,,fail on concentration,,Direct to ULI,icAniHume1,0.80196,SE303342T,TRUE,,29/09/2022,n/a,,Not in WGS,Not in WGS,FALSE,FALSE,Charge,August 2022,,,
  Production 10,FD20709657,DTOL12955862,,0.38,,,04/07/2022,lk11/mf21,Powermash,0.5,Non-plant,2h@25C,FD20709657,,,Yes,FD38542460,SA01034044,H5,2.12,380,805.6,7.48,1.72,0.89,5.25,38463,3,2022 07 04 16H 39M,Pass,,,,,,05/07/2022,lk11/mf21,,,,,Ed Sheeran,30,370,0.6x AMPure PB (manual),TRUE,360,216,7.44,46,342.24,28.76,1.87,1.15,13.4,42.5,13749,6.7,2022 07 11 10H 18M,,Fail,,,fail on concentration - likely due to issue with hydropore,,Direct to ULI,iyAndSubo1,0.375,SE303343U,TRUE,,29/09/2022,n/a,,Not in WGS,Not in WGS,FALSE,FALSE,Charge,August 2022,,,
  Production 10,FD20709697,DTOL12955863,,0.38,,,04/07/2022,lk11/mf21,Powermash,13.7,Non-plant,2h@25C,FD20709697,,,Yes,FD38542461,SA01034044,A6,5.16,380,1960.8,19.64,1.59,0.88,11.03,40093,3.1,2022 07 04 16H 39M,Pass,,,,,,05/07/2022,lk11/mf21,,,,,Ed Sheeran,30,365,0.6x AMPure PB (manual),TRUE,350,210,21.2,46,975.2,83.8,1.89,1.22,42.87,49.7,11672,6,2022 07 11 10H 18M,,Pass,,,,,,iyAndChry1,0.375,SE293723V,TRUE,,19/07/2022,14.3,,PASS,26.06,FALSE,FALSE,Charge,August 2022,,,
  Production 10,FD20706661,DTOL12955864,,0.40,,,04/07/2022,lk11/mf21,Powermash,0.01,Non-plant,2h@25C,FD20706661,,,Yes,FD38542462,SA01034044,B6,0.582,380,221.16,1.328,0.99,1.25,1.2,48788,4.7,2022 07 04 16H 39M,On Hold ULI,,,,low yield,,,,,,,,,,,,FALSE,,,,,,,,,,0.0,,,,,On Hold ULI,,,,,Proceed with ULI,icAnaFasc1,0.40098,,TRUE,,,,,Not in WGS,Not in WGS,FALSE,FALSE,Charge,August 2022,,,
  Production 10,FD20709577,DTOL12955865,,1.45,,,04/07/2022,lk11/mf21,Powermash,0.01,Non-plant,2h@25C,FD20709577,,,Yes,FD38542463,SA01034044,C6,5.28,380,2006.4,20.12,1.68,0.98,8.34,14415,0.5,2022 07 04 16H 39M,Pass,,,,"poor profile, low GQN // passed on 17/8/22 (em)",,,,,,,,,,,,FALSE,,0,,,,,,,,,,,,,,,,Think can ID this sample asn FD32230232,,,icAnaLimb1,1.44744,,TRUE,,,,,Not in WGS,Not in WGS,FALSE,FALSE,Charge,August 2022,,,
  Production 10,FD20706441,DTOL12955866,,0.55,,,04/07/2022,lk11/mf21,Powermash,0.01,Non-plant,2h@25C,FD20706441,,,Yes,FD38542464,SA01034044,D6,2.68,380,1018.4,9.72,1.77,-0.25,2.79,69860,6.2,2022 07 04 18H 07M,Pass,,,,,,05/07/2022,lk11/mf21,,,,,Ed Sheeran,30,360,0.6x AMPure PB (manual),TRUE,345,207,8.8,46,404.8,34.2,1.98,1.52,14.19,39.7,13800,7.8,2022 07 11 10H 18M,,Fail,,,"concentration borderline, good profile. Failed on yield 01/08/2022",,Direct to ULI,ilAleLoef1,0.553333,SE303344V,TRUE,,29/09/2022,n/a,,Not in WGS,Not in WGS,FALSE,FALSE,Charge,August 2022,,,
  Production 10,FD20709574,DTOL12955867,,0.91,,,04/07/2022,lk11/mf21,Powermash,0.01,Non-plant,2h@25C,FD20709574,,,Yes,FD38542465,SA01034044,E6,0.886,380,336.68,2.544,6.94,0.76,0.4,32521,4,2022 07 04 18H 07M,On Hold ULI,,,,low yield,,,,,,,,,,,,FALSE,,,,,,,,,,0.0,,,,,On Hold ULI,,,,,Proceed to ULI,icAcuDubi1,0.912,,TRUE,,,,,Not in WGS,Not in WGS,FALSE,FALSE,Charge,August 2022,,,
  Production 10,FD20710655,DTOL12955868,,0.65,,,04/07/2022,lk11/mf21,Powermash,14.1,Non-plant,2h@25C,FD20710655,,,Yes,FD38542466,SA01034044,F6,14.5,380,5510,57,1.47,1.04,22.27,41382,3.6,2022 07 04 18H 07M,Pass,,,,,,05/07/2022,lk11/mf21,,,,,Ed Sheeran,30,360,0.6x AMPure PB (manual),TRUE,335,201,53.8,46,2474.8,214.2,1.84,1.53,69.54,44.9,11926,6.3,2022 07 11 10H 18M,,Pass,,,,,,ilAcrAdve1,0.647647,SE293779O,TRUE,,19/07/2022,22,,PASS,34.23,FALSE,FALSE,Charge,August 2022,,,
  Production 10,FD20709546,DTOL12955869,,1.05,,,04/07/2022,lk11/mf21,Powermash,0.01,Non-plant,2h@25C,FD20709546,,,Yes,FD38542467,SA01034044,G6,0.212,380,80.56,-0.152,1.2,0.69,2.64,56684,5.8,2022 07 04 18H 07M,On Hold ULI,,,,nice profile but low concentration - hold for ULI?,,,,,,,,,,,,FALSE,,,,,,,,,,0.0,,,,,On Hold ULI,,,,,NEED TO CONFIRM,icAcrNigr1,1.045282,,TRUE,,,,,Not in WGS,Not in WGS,FALSE,FALSE,Charge,August 2022,,,
  Production 10,FD20709549,DTOL12955870,,1.14,,,04/07/2022,lk11/mf21,Powermash,9.2,Non-plant,2h@25C,FD20709549,,,Yes,FD38542468,SA01034044,H6,8.32,380,3161.6,32.28,1.67,1.33,11.84,29665,2.7,2022 07 04 18H 07M,Pass,,,,,,05/07/2022,lk11/mf21,,,,,Ed Sheeran,30,360,0.6x AMPure PB (manual),TRUE,325,195,40,46,1840,159,1.91,2.09,56.61,58.2,11065,5.9,2022 07 11 10H 18M,,Pass,,,,,,icAgrSput1,1.13819,SE293780H,TRUE,,19/07/2022,21.7,,PASS,28.46,FALSE,FALSE,Charge,August 2022,,,
  Production 11,FF10125466,DTOL12955871,,0.77,,,05/07/2022,fs17,Cryoprep,30.5,Plant,1h@55C,,,,Yes,FD38542364,SA01034044,B7,0.324,380,123.12,0.296,1.02,0.15,1.133,45219,4.4,2022 07 05 18H 34M,On Hold ULI,,,,,Proceed to ULI,17/10/2022,lk11/mls,,,,,Gtube,,,0.6x AMPure PB (manual),FALSE,355,1100,1.47,45,66.15,,,,,53.7,12776,7.9,2022 10 18 22H 48M,,Pass,,,,,Proceed to ULI,drRobPseu1,0.77262,SE305610F,TRUE,,07/01/2022,n/a,,Not in WGS,Not in WGS,FALSE,FALSE,Charge,August 2022,,,
  Production 11,FF10125203,DTOL12955872,,1.11,,,05/07/2022,fs17,Cryoprep,60,Plant,1h@55C,NA,,,Yes,FD38542365,SA01034044,C7,11.6,380,4408,45.4,1.71,2.43,20.53,54659,5.3,2022 07 05 18H 34M,Pass,,,,,,06/07/2022,fs17,340,204,200,,Alan Shearer,30,200,0.6x AMPure PB (manual),TRUE,186,111.6,48.2,45.4,2188.28,191.8,1.69,1.11,68.94,49.6,14299,8.4,2022 07 07 15H 49M,,Pass,,,Sample difficult to shear. Pre shear 0.6X Ampure PB SPRI; elution in 200uL EB. Used new hydropore syringe and this time didn't clog hydropore,,,dmGlaFlav1,1.11492,SE293625U,TRUE,,12/07/2022,26.2,,PASS,11.90,FALSE,FALSE,Charge,August 2022,,,
  Production 11,FF10125577,DTOL12955873,,1.61,,,05/07/2022,fs17,Cryoprep,58,Plant,1h@55C,FD32230227,fk00223822,D9,Yes,FD38542371,SA01034044,D7,0.584,380,221.92,1.336,1.48,0.3,7.743,12337,0.4,2022 07 05 18H 34M,Failed Profile,,,,cloudy eluate (green); placed on magnet - it helped clear out,,,,,,,,,,,,FALSE,,,,,,,,,,,,,,,Fail,,,,,,ddGlaMari1,1.6137,,TRUE,,,,,Not in WGS,Not in WGS,FALSE,FALSE,Charge,August 2022,,,
  Production 11,FF10125198,DTOL12955874,,4.76,,,05/07/2022,fs17,Cryoprep,62,Plant,1h@55C,NA,,,Yes,FD38542367,SA01034044,E7,3.66,380,1390.8,13.64,2.24,2.41,5.439,52446,4.6,2022 07 05 18H 34M,Pass,,,,,,06/07/2022,fs17,,,,,Alan Shearer,30,350,0.6x AMPure PB (manual),TRUE,335,201,19.1,45.4,867.14,75.4,1.92,1.14,16.89,62.3,15622,7.7,2022 07 07 15H 49M,,Pass,,,,,,drLatApha1,4.76286,SE293626V,TRUE,,12/07/2022,n/a,,FAIL,1.10,FALSE,FALSE,Charge,August 2022,,,
  Production 11,FF10125422,DTOL12955875,,23.91,,,05/07/2022,fs17,Cryoprep,60,Plant,1h@55C,NA,,,Yes,FD38542368,SA01034044,F7,16.9,180,3042,66.6,2.03,2.28,20.47,56902,5.6,2022 07 05 18H 34M,Pass,,,,final elution only 200uL - FS prob forgot to add 200uL to a well in one of the elution plates,,06/07/2022,fs17,,,,,Britney Shears,30,158,0.6x AMPure PB (manual),TRUE,146,87.6,47.6,45.4,2161.04,189.4,1.9,1.89,42.84,71.0,13496,7.5,2022 07 07 15H 49M,,Pass,,,,,,lsHyaNons1,23.9121,SE293627W,TRUE,,12/07/2022,n/a,,PASS,17.58,FALSE,FALSE,Charge,August 2022,,,
  Production 11,FF10125393,DTOL12955876,Diphasiastrum alpinum,3.99,,,05/07/2022,fs17,Cryoprep,57,Plant,1h@55C,NA,,,Yes,FD38542369,SA01034044,G7,3.36,380,1276.8,12.44,1.4,0.59,50.24,22432,1.8,2022 07 05 18H 34M,Pass,,,let's try (em27),eluate cloudy but see through,,06/07/2022,fs17,,,,,Alan Shearer,30,340,0.6x AMPure PB (manual),TRUE,330,198,19.9,45.4,903.46,78.6,1.64,0.5,78.57,70.8,9757,3.5,2022 07 12 15H 42M,,Fail,,,"Failed on profile, 4Gb genome. Sample difficult to shear. Sample span down for a few minutes and debris/pellet not transferred to new tube. Repeat femto report added",,Submit to Lib Prep,vlDipAlpi1,3.99024,FF10125393,TRUE,,06/12/2022,n/a,,Not in WGS,Not in WGS,FALSE,FALSE,Charge,August 2022,,,
  Production 11,FF10125218,DTOL12955877,,16.48,,,05/07/2022,fs17,Cryoprep,61.5,Plant,1h@55C,NA,,,Yes,FD38542370,SA01034044,H7,7.84,380,2979.2,30.36,1.27,0.77,13.36,38589,4.2,2022 07 05 18H 34M,Pass,,,,,,06/07/2022,fs17,330,198,200,,Alan Shearer,30,200,0.6x AMPure PB (manual),TRUE,191,114.6,36.8,45.4,1670.72,146.2,1.95,1.67,33.52,56.1,17228,7.3,2022 07 07 15H 49M,,Pass,,,Sample difficult to shear. Pre shear 0.6X Ampure PB SPRI; elution in 200uL EB. Used new hydropore syringe and this time didn't clog hydropore,,,dmAdoAnnu1,16.4793,SE293628A,TRUE,,12/07/2022,17.5,,PASS,14.74,FALSE,FALSE,Charge,August 2022,,,
  Production 11,FF10125491,DTOL12955878,,1.80,,,05/07/2022,fs17,Cryoprep,65.3,Plant,1h@55C,NA,,,Yes,FD38542366,SA01034044,A8,10.5,380,3990,41,1.38,1.11,29.63,42048,4.4,2022 07 05 20H 01M,Pass,,,,,,06/07/2022,fs17,330,198,200,,Alan Shearer,30,200,0.6x AMPure PB (manual),TRUE,186,111.6,41.2,45.4,1870.48,163.8,1.6,0.95,55.61,46.9,17967,8.1,2022 07 07 15H 49M,,Pass,,,Sample difficult to shear. Pre shear 0.6X Ampure PB SPRI; elution in 200uL EB. Used new hydropore syringe and this time didn't clog hydropore,,,drAlcMica1,1.79952,SE293629B,TRUE,,12/07/2022,15.2,,FAIL,5.05,FALSE,FALSE,Charge,August 2022,,,
  Production 10,FD20710719,DTOL12955879,,0.99,,,04/07/2022,lk11/mf21,Powermash,20,Non-plant,2h@25C,FD20710719,,,Yes,FD38542469,SA01034044,A7,3.62,380,1375.6,13.48,1.93,1.03,5.28,36995,3.3,2022 07 04 18H 07M,Pass,,,,,,05/07/2022,lk11/mf21,,,,,Ed Sheeran,30,360,0.6x AMPure PB (manual),TRUE,340,204,17.4,46,800.4,68.6,1.88,1.86,25.94,58.2,7734,0.8,2022 07 11 10H 18M,,Fail,Fail,,fail on femto profile,,,idCorCili1,0.989438,,TRUE,,,,,Not in WGS,Not in WGS,FALSE,FALSE,Charge,August 2022,,,
  Production 11,FF10125514,DTOL12955880,,7.07,,,05/07/2022,sc45,Cryoprep,57.8,Plant,1h@55C,NA,,,Yes,FD38542372,SA01034044,B8,8.32,380,3161.6,32.28,1.62,-3.06,11.88,36646,3.8,2022 07 05 20H 01M,Pass,,,,,,06/07/2022,sc45,,,,,Ed Sheeran,30,330,0.6x AMPure PB (manual),TRUE,209,125.4,51,45.4,2315.4,203,1.82,1.65,53.1,73.2,12939,7,2022 07 11 10H 18M,,Pass,,,Sample difficult to shear. Pre shear 0.6X Ampure PB SPRI; elution in 200uL EB. Used new hydropore syringe and this time didn't clog hydropore,,,lsIriFoet1,7.072038,SE293781I,TRUE,,19/07/2022,20.2,,FAIL,8.28,FALSE,FALSE,Charge,August 2022,,,
  Production 11,FF10125668,DTOL12955881,,0.87,,,05/07/2022,sc45,Cryoprep,72.5,Plant,1h@55C,NA,,,Yes,FD38542373,SA01034044,C8,16.8,380,6384,66.2,1.82,7.44,20.88,47242,5.3,2022 07 05 20H 01M,Pass,,,,,,06/07/2022,sc45,,,,,Ed Sheeran,30,215,0.6x AMPure PB (manual),TRUE,339,203.4,96.2,45.4,4367.48,383.8,1.8,1.6,107.2,68.4,13991,8.2,2022 07 08 15H 33M,,Pass,,,,,,daVinMino1,0.87042,SE293782J,TRUE,,19/07/2022,22.5,,PASS,12.25,FALSE,FALSE,Charge,August 2022,,,
  Production 11,FF10125556,DTOL12955882,,0.43,,,05/07/2022,sc45,Cryoprep,52.4,Plant,1h@55C,NA,,,Yes,FD38542374,SA01034044,D8,4.62,380,1755.6,17.48,1.52,1.44,13.61,30715,3.3,2022 07 05 20H 01M,Pass,,,,,,06/07/2022,sc45,,,,,Ed Sheeran,30,352,0.6x AMPure PB (manual),TRUE,198,118.8,10.5,45.4,476.7,41,1.93,0.95,14.86,27.2,15447,7.7,2022 07 08 15H 33M,,Pass,,,"Good profile, but under 500ng. Sample difficult to shear. Pre shear 0.6X Ampure PB SPRI; elution in 200uL EB. Used new hydropore syringe and this time didn't clog hydropore. this needs to be pushed to PB LP. // Passed by em on the 18/8/22",,,daVerSerp1,0.43032,SE297151A,TRUE,,26/08/2022,10.6,,FAIL,1.52,FALSE,FALSE,Charge,August 2022,,,
  Production 11,FF10125522,DTOL12955883,,0.43,,,05/07/2022,sc45,Cryoprep,54.6,Plant,1h@55C,NA,,,Yes,FD38542375,SA01034044,E8,7.6,380,2888,29.4,1.53,1.96,23.28,37487,3.3,2022 07 05 20H 01M,Pass,,,,,,06/07/2022,sc45,,,,,Ed Sheeran,30,215,0.6x AMPure PB (manual),TRUE,203,121.8,23.8,45.4,1080.52,94.2,1.8,1.13,29.07,37.4,18073,8,2022 07 08 15H 33M,,Pass,,,Sample difficult to shear. Pre shear 0.6X Ampure PB SPRI; elution in 200uL EB. Used new hydropore syringe and this time didn't clog hydropore,,,daVerArve1,0.42543,SE293783K,TRUE,,19/07/2022,n/a,,FAIL,4.86,FALSE,FALSE,Charge,August 2022,,,
  Production 11,FF10125637,DTOL12955884,,1.86,,,05/07/2022,sc45,Cryoprep,56.5,Plant,1h@55C,NA,,,Yes,FD38542376,SA01034044,F8,3.24,380,1231.2,11.96,3.34,-1.02,3.037,43584,4.5,2022 07 05 20H 01M,Pass,,,,,,06/07/2022,sc45,,,,,Ed Sheeran,30,215,0.6x AMPure PB (manual),TRUE,211,126.6,11.5,45.4,522.1,45,2.19,0.99,12.41,42.4,20787,7.8,2022 07 08 15H 33M,,Pass,,,Sample difficult to shear. Pre shear 0.6X Ampure PB SPRI; elution in 200uL EB. Used new hydropore syringe and this time didn't clog hydropore,,,drUmbRupe1,1.8582,SE293784L,TRUE,,19/07/2022,n/a,,PASS,20.68,FALSE,FALSE,Charge,August 2022,,,
  Production 11,FF10125584,DTOL12955885,,1.98,,,05/07/2022,sc45,Cryoprep,65.8,Plant,1h@55C,FD32230228,fk00223822,A4,Yes,FD38542377,SA01034044,G8,out of range (too little),380,#VALUE!,#VALUE!,0.58,0.49,-0.8153,20767,1.5,2022 07 05 20H 01M,Fail,,,,failed on concentration,,,,,,,,,,,,FALSE,,0,,,,,,,,, ,,,,Fail,,,,,Fail,drUlmProc1,1.97556,,TRUE,,,,,Not in WGS,Not in WGS,FALSE,FALSE,Charge,August 2022,,,
  Production 11,FF10125435,DTOL12955886,,0.54,,,05/07/2022,sc45,Cryoprep,63.2,Plant,1h@55C,NA,,,Yes,FD38542378,SA01034044,H8,6.68,380,2538.4,25.72,1.8,9.54,11.89,24834,2.1,2022 07 05 20H 01M,Pass,,,let's try (em27),,,06/07/2022,sc45,,,,,Ed Sheeran,30,215,0.6x AMPure PB (manual),TRUE,215,129,36.2,45.4,1643.48,143.8,1.87,1.45,40.78,64.7,15212,6.5,2022 07 08 15H 33M,,Pass,,,Sample difficult to shear. Pre shear 0.6X Ampure PB SPRI; elution in 200uL EB. Used new hydropore syringe and this time didn't clog hydropore,,,drTriSubt1,0.54279,SE293785M,TRUE,,19/07/2022,10,,FAIL,2.83,FALSE,FALSE,Charge,August 2022,,,
  Production 11,FF10125608,DTOL12955887,,0.47,,,05/07/2022,sc45,Cryoprep,54.5,Plant,1h@55C,FD32230229,fk00223822,A11,Yes,FD38542379,SA01034044,A9,0.612,380,232.56,1.448,2.03,1.04,7.785,9686,0.1,2022 07 05 20H 01M,Fail,,,,failed profile and concentration,,,,,,,,,,,,FALSE,,,,,,,,,,0.0,,,,,Fail,,,,,Fail,drTriArve1,0.46944,,TRUE,,,,,Not in WGS,Not in WGS,FALSE,FALSE,Charge,August 2022,,,
  Production 12,FF10125415,DTOL12955888,,2.35,,,11/07/2022,lk11,Cryoprep,65.2,Plant,1h@55C,,,,Yes,FD38542380,SA01034044,B9,1.49,380,566.2,4.96,3.03,-2,2.165,55158,5,2022 07 12 13H 32M,Pass,,,,,,13/07/2022,sc45,357,214.2,200,,Ed Sheeran,30,200,0.6x AMPure PB (manual),TRUE,188,112.8,9.42,45,423.9,36.68,1.78,1.1,10.86,74.9,15448,7.6,2022 07 15 12H 03M,,Pass,,,low concentration /borderline,,,daTraPrat1,2.3472,SE293786N,TRUE,,19/07/2022,n/a,,Not in WGS,Not in WGS,FALSE,FALSE,Charge,August 2022,,,
  Production 12,FF10125363,DTOL12955889,,1.61,,,11/07/2022,lk11,Cryoprep,70.1,Plant,1h@55C,FD32230239,fk00223822,B10,Yes,FD38542381,SA01034044,C9,0.332,380,126.16,0.328,0.71,2.88,-1.51,40121,4.2,2022 07 12 13H 32M,On Hold ULI,,,,,,,,,,,,,,,,FALSE,,,,,0,-1,,,,0.0,,,,,On Hold ULI,,,,,Multiple extractions (TOL),ddGlaMari1,1.6137,,TRUE,,,,,Not in WGS,Not in WGS,FALSE,FALSE,Charge,August 2022,,,
  Production 12,FF10125656,DTOL12955890,,30.80,,,11/07/2022,lk11,Cryoprep,66.5,Plant,1h@55C,,,,Yes,FD38542382,SA01034044,D9,9.94,380,3777.2,38.76,2.11,-6.4,15.8,37289,3.6,2022 07 12 13H 32M,Pass,,,,,,13/07/2022,sc45,353,211.8,200,,Ed Sheeran,30,200,0.6x AMPure PB (manual),TRUE,189,113.4,48.6,45,2187,193.4,1.91,2.25,42.81,57.9,17210,6.8,2022 07 15 12H 03M,,Pass,,,"sample passed 01/08/2022. Wide profile, good yield",,,veEquVari1,30.79722,SE294642C,TRUE,,05/08/2022,17.1,,PASS,23.56,FALSE,FALSE,Charge,August 2022,,,
  Production 12,FF10125497,DTOL12955891,,7.23,,,11/07/2022,lk11,Cryoprep,85.4,Plant,1h@55C,,,,Yes,FD38542383,SA01034044,E9,1.48,380,562.4,4.92,1.62,1.14,3.079,46639,4.5,2022 07 12 13H 32M,Pass,,,,,,13/07/2022,sc45,366,219.6,200,,Ed Sheeran,30,200,0.6x AMPure PB (manual),TRUE,191,114.6,6.92,45,311.4,26.68,1.72,2.09,5.106,55.4,14400,7.5,2022 07 15 12H 03M,,Fail,Fail,,,,Multiple extractions (TOL),voPheConn1,7.22742,,TRUE,,,,,Not in WGS,Not in WGS,FALSE,FALSE,Charge,August 2022,,,
  Production 12,FF05128067,DTOL12955892,,1.32,,,11/07/2022,lk11,Cryoprep,46.4,Plant,1h@55C,,,,Yes,FD38542384,SA01034044,F9,1.6,380,608,5.4,2.54,1.46,2.999,50045,4.9,2022 07 12 13H 32M,Pass,,,,,,13/07/2022,sc45,367,220.2,200,,Ed Sheeran,30,200,0.6x AMPure PB (manual),TRUE,194,116.4,9.68,45,435.6,37.72,1.77,1.15,10.6,71.6,14243,7.8,2022 07 15 12H 03M,,Pass,,,low concentration /borderline,,,daPlaMari1,1.3203,SE293787O,TRUE,,19/07/2022,n/a,,PASS,19.15,FALSE,FALSE,Charge,August 2022,,,
  Production 12,FF10128627,DTOL12955893,,1.03,,,11/07/2022,lk11,Cryoprep,59,Plant,1h@55C,,,,Yes,FD38542385,SA01034044,G9,2.28,380,866.4,8.12,1.68,1.25,7.038,34240,3.6,2022 07 12 13H 32M,Pass,,,,,,13/07/2022,sc45,370,222,200,,Ed Sheeran,30,200,0.6x AMPure PB (manual),TRUE,193,115.8,14.1,45,634.5,55.4,1.73,0.54,26.36,73.2,13981,6.9,2022 07 15 12H 03M,,Pass,,,,,,dmCerDeme1,1.0269,SE293788P,TRUE,,19/07/2022,n/a,,PASS,14.14,FALSE,FALSE,Charge,August 2022,,,
  Production 12,FF05129000,DTOL12955894,,1.79,,,11/07/2022,lk11,Cryoprep,49,Plant,1h@55C,,,,Yes,FD38542386,SA01034044,H9,8.26,380,3138.8,32.04,2.11,4.19,44.09,37982,2.3,2022 07 12 13H 32M,Pass,,,,large LMW peak. RNA?,,13/07/2022,lk11,360,216,200,,Britney Shears,30,200,0.6x AMPure PB (manual),TRUE,194,116.4,33.6,45,1512,133.4,1.83,1.53,36.64,48.2,13772,7.2,2022 07 15 12H 03M,,Pass,,,,,,daCamGlom1,1.78974,SE293789Q,TRUE,,19/07/2022,13.1,,PASS,13.84,FALSE,FALSE,Charge,August 2022,,,
  Production 12,FF10136787,DTOL12955895,,9.18,,,11/07/2022,lk11,Cryoprep,58,Plant,1h@55C,FD32230240,fk00223822,C5,Yes,FD38542387,SA01034044,A10,1.29,380,490.2,4.16,-4.13,-1.12,0.8004,17738,1.3,2022 07 12 13H 32M,Failed Profile,,,,bad femto profile and low concentration,,,,,,,,,,,,FALSE,,,,,0,-1,,,,0.0,,,,,Fail,,,,,Multiple extractions (TOL),voAspMari1,9.18342,,TRUE,,,,,Not in WGS,Not in WGS,FALSE,FALSE,Charge,August 2022,,,
  Production 12,FF10136803,DTOL12955896,,4.52,,,11/07/2022,sc45,Cryoprep,56,Plant,1h@55C,FD32230241,fk00223822,C10,Yes,FD38542388,SA01034044,B10,0.734,380,278.92,1.936,1.33,0.19,1.261,45999,4.6,2022 07 12 13H 32M,On Hold ULI,,,,,,,,,,,,,,,,FALSE,,,,,0,-1,,,,0.0,,,,,On Hold ULI,,,,,Multiple extractions (TOL),voAspViri1,4.51836,,TRUE,,,,,Not in WGS,Not in WGS,FALSE,FALSE,Charge,August 2022,,,
  Production 12,FF05129025,DTOL12955897,,1.79,,,11/07/2022,sc45,Cryoprep,57,Plant,1h@55C,FD32230242,fk00223822,D4,Yes,FD38542389,SA01034044,C10,0.508,380,193.04,1.032,0.18,0.09,-0.2081,42082,4.3,2022 07 12 13H 32M,On Hold ULI,,,,,,,,,,,,,,,,FALSE,,,,,0,-1,,,,0.0,,,,,On Hold ULI,,,,,Multiple extractions (TOL),dcAtrPrae1,1.78974,,TRUE,,,,,Not in WGS,Not in WGS,FALSE,FALSE,Charge,August 2022,,,
  Production 12,FF10136836,DTOL12955898,,0.90,,,11/07/2022,sc45,Cryoprep,45,Plant,1h@55C,,,,Yes,FD38542390,SA01034044,D10,0.602,380,228.76,1.408,0.31,0.41,-0.3124,32245,3.8,2022 07 12 13H 32M,On Hold ULI,,,,,Proceed to ULI,17/10/2022,lk11/mls,,,,,Gtube,,,0.6x AMPure PB (manual),FALSE,345,1069,3.48,45,156.6,,,,,68.5,12418,7.7,2022 10 18 22H 48M,,Pass,,,,,Proceed to ULI,dcAtrLitt1,0.89976,SE305611G,TRUE,,07/01/2022,n/a,,Not in WGS,Not in WGS,FALSE,FALSE,Charge,August 2022,,,
  Production 12,FF10128644,DTOL12955899,,0.84,,,11/07/2022,sc45,Cryoprep,69,Plant,1h@55C,,,,Yes,FD38542391,SA01034044,E10,1.51,380,573.8,5.04,2.66,15.61,5.719,31702,2.2,2022 07 12 15H 42M,Pass,,,,,,13/07/2022,lk11,355,213,200,,Britney Shears,30,200,0.6x AMPure PB (manual),TRUE,185,111,6.32,45,284.4,24.28,2.1,1.66,6.4,49.6,17176,7.4,2022 07 15 12H 03M,,Fail,Fail,,TOL to repeat submission,,Fail,dcAtrLaci1,0.84108,,TRUE,,,,,Not in WGS,Not in WGS,FALSE,FALSE,Charge,August 2022,,,
  Production 12,FF10128775,DTOL12955900,,1.00,,,11/07/2022,sc45,Cryoprep,61,Plant,1h@55C,,,,Yes,FD38542392,SA01034044,F10,1.2,380,456,3.8,-34.79,-5.77,2.057,35183,3.7,2022 07 12 15H 42M,Pass,,,,,,13/07/2022,lk11,355,213,200,,Britney Shears,30,200,0.6x AMPure PB (manual),TRUE,186,111.6,5.22,45,234.9,19.88,2.7,2.06,4.68,51.5,15081,7.1,2022 07 15 12H 03M,,Fail,,,,,Direct to ULI,dcAtrGlab1,0.99756,SE305486T,TRUE,,17/10/2022,n/a,,Not in WGS,Not in WGS,FALSE,FALSE,Charge,August 2022,,,
  Production 12,FF10136819,DTOL12955901,,3.37,,,11/07/2022,sc45,Cryoprep,65,Plant,1h@55C,,,,Yes,FD38542393,SA01034044,G10,47.8,380,18164,190.2,1.61,0.88,102.8,62824,5.6,2022 07 12 15H 42M,Pass,,,,,,13/07/2022,lk11,330,198,200,,Ed Sheeran,30,400x2,0.6x AMPure PB (manual),TRUE,781,468.6,210,45,9450,839,1.86,1.91,33.18,52.0,11939,7.4,2022 07 15 12H 03M,,Pass,,,"hydropore blocked, sample was spun down and transferred into new tube, then topped upto 500ul, then split across two hydropores and topped upto 400ul each",,,daArtVulg1,3.3741,SE293790J,TRUE,,19/07/2022,28.8,,PASS,28.36,FALSE,FALSE,Charge,August 2022,,,
  Production 12,FF10136840,DTOL12955902,,6.49,,,11/07/2022,sc45,Cryoprep,54,Plant,1h@55C,,,,Yes,FD38542394,SA01034044,H10,13.1,380,4978,51.4,2.01,2.46,27.8,40684,3.7,2022 07 12 15H 42M,Pass,,,,,,13/07/2022,lk11,355,213,200,,Alan Shearer,30,500,0.6x AMPure PB (manual),TRUE,466,279.6,71.2,45,3204,283.8,1.91,2.1,61.62,64.4,12515,6.5,2022 07 15 12H 03M,,Pass,,,"hydropore blocked, sample was spun down and transferred into new tube, then topped upto 500ul",,,lpGlyMaxi1,6.49392,SE293791K,TRUE,,19/07/2022,n/a,,PASS,26.31,FALSE,FALSE,Charge,August 2022,,,
  Production 10,Control (5mil),,,#N/A,,,04/07/2022,lk11/mf21,Powermash,NA,Cell Line,2h@25C,Control,,,No,N/A,,,5.12,380,1945.6,19.48,2.01,1.38,10.13,48802,3.5,2022 07 04 18H 07M,NA (control),,,,CGAP-23AAEF #5,,,,,,,,,,,,FALSE,,,,,0,-1,,,,0.0,,,,,,,,,,,,#N/A,CONTROL,TRUE,,,,,Not in WGS,Not in WGS,FALSE,FALSE,No Charge,CONTROL - do not charge,,,
  Production 11,Control (5mil),,,#N/A,,,05/07/2022,fs17/sc45,Powermash,NA,Cell Line,1h@55C,FD32230230,Rack 1,,No,,,,4.86,380,1846.8,18.44,1.56,2.79,6.22,43916,4.4,2022 07 05 20H 01M,NA (control),,,,CA CGAP-23AC34 $GM24385,,,,,,,,,,,,FALSE,,,,,0,-1,,,,0.0,,,,,,,,,,,,#N/A,CONTROL,TRUE,,,,,Not in WGS,Not in WGS,FALSE,FALSE,No Charge,CONTROL - do not charge,,,
  Production 14,FD20706617,DTOL13012583,,0.40,,,19/07/2022,fs17,Powermash,12.7,Non-plant,2h@25C,NA,,,Yes,FD38542425,Rack 2,,8.22,390,3205.8,31.88,2.19,1.85,13.78,35470,3,2022 07 19 19H 58M,Pass,,,,,,20/07/2022,fs17,N/A,N/A,N/A,,Ed Sheeran,30,384,0.6x AMPure PB (manual),TRUE,352,211.2,55,45.4,2497,219,1.9,1.91,56.73,77.9,11168,5.5,2022 07 20 21H 48M,,Pass,,,,21/07/2022,,icOedLuri3,0.40098,SE293944J,TRUE,,21/07/2022,41.5,,PASS,18.92,FALSE,FALSE,Charge,August 2022,,,
  Production 12,FF10125310,DTOL13012584,,1.22,,,11/07/2022,sc45,Cryoprep,53.05,Plant,1h@55C,FD32230244,fk00223822,A6,Yes,FD38542395,SA01034044,A11,0.558,380,212.04,1.232,4.01,-5.71,3.105,32064,1.6,2022 07 12 15H 42M,Fail,,,,lots of LMW DNA and low concentration,,,,,,,,,,,,FALSE,,,,,0,-1,,,,0.0,,,,,Fail,,,,,Multiple extractions,dcRumAceo1,1.2225,,TRUE,,,,,Not in WGS,Not in WGS,FALSE,FALSE,Charge,August 2022,,,
  Production 13,FF10125635,DTOL13012585,,6.28,,,12/07/2022,zg1,Cryoprep,75.9,Plant,1h@55C,N/A,,,Yes,FD38542396,SA01034044,B11,2.04,380,775.2,7.16,1.95,2.66,4.936,48994,5.1,2022 07 12 15H 42M,Pass,,,,,,13/07/2022,zg1,350,210,200,,Alan Shearer,30,200,0.6x AMPure PB (manual),TRUE,190,114,9.38,45.4,425.852,36.52,1.73,0.76,18.38,54.9,13151,7.3,2022 07 14 16H 17M,,Pass,,,,,,daLitUnif1,6.27876,SE293792L,TRUE,,19/07/2022,n/a,,FAIL,2.61,FALSE,FALSE,Charge,August 2022,,,
  Production 13,FF10125641,DTOL13012586,,0.80,,,12/07/2022,zg1,Cryoprep,52,Plant,1h@55C,N/A,,,Yes,FD38542397,SA01034044,C11,1.86,380,706.8,6.44,2.07,3.42,2.22,28320,2.4,2022 07 12 15H 42M,Pass,,,,,,13/07/2022,zg1,352,211.2,200,,Alan Shearer,30,200,0.6x AMPure PB (manual),TRUE,190,114,9.4,45.4,426.76,36.6,2.6,1.17,8.297,60.4,16850,5.9,2022 07 14 16H 17M,,Fail,,,not great profile and low concentration,,Submit to Lib Prep,daOriVulg1,0.80196,SE305510C,TRUE,,17/10/2022,n/a,,Not in WGS,Not in WGS,FALSE,FALSE,Charge,August 2022,,,
  Production 13,FF10125282,DTOL13012587,,0.89,,,12/07/2022,zg1,Cryoprep,45,Plant,1h@55C,N/A,,,Yes,FD38542398,SA01034044,D11,5.04,380,1915.2,19.16,2.21,5.83,28.14,24935,1.2,2022 07 12 17H 10M,Pass,,,,,,13/07/2022,zg1,340,204,200,,Alan Shearer,30,200,0.6x AMPure PB (manual),TRUE,186,111.6,14.4,45.4,653.76,56.6,1.98,0.93,17.96,34.1,16950,6.2,2022 07 14 16H 17M,,Pass,,,Unusual profile. Sample passed due to another sample (FD32230173) with similar profile getting good sequencing results. Also small genome 0.8Gb. Passed 12/08/2022,,,daEchVulg1,0.88998,SE295943Q,TRUE,,19/08/2022,n/a,,PASS,11.49,FALSE,FALSE,Charge,August 2022,,,
  Production 14,FB01533642,DTOL13012588,,0.88,,,19/07/2022,fs17,Powermash,5.6,Non-plant,2h@25C,NA,,,Yes,FD38542426,Rack 3,,2.68,390,1045.2,9.72,10.37,-4.18,2.398,36565,3,2022 07 19 19H 58M,Pass,,,,,,20/07/2022,fs17,N/A,N/A,N/A,,Britney Shears,30,362,0.6x AMPure PB (manual),TRUE,354,212.4,13.7,45.4,621.98,53.8,2.03,1.7,14.87,59.5,14014,6.3,2022 07 20 21H 48M,,Pass,,,,21/07/2022,,ihNeoCont1,0.8802,SE293951I,TRUE,,21/07/2022,n/a,,PASS,17.95,FALSE,FALSE,Charge,August 2022,,,
  Production 15,FF10125288,DTOL13012589,,1.43,,,18/07/2022,lk11,Cryoprep,54,Plant,1h@55C,,,,Yes,FD38542412,,,5.08,300,1524,,1.89,-1.01,5.78,38174,3.8,2022 07 18 15H 38M,Pass,,,,,,19/07/2022,zg1,190,114,200,,Alan Shearer,30,400*2,0.6x AMPure PB (manual),FALSE,775,465,12,45,540,47,1.99,0.86,18.88,35.4,13248,7.3,2022 07 22 13H 15M,,Pass,,,"sample clogged hydropore, topped upto 500ul, then split across 2 hyropores and topped upto 400ul",,,daCenNigr1,1.42788,SE294008F,TRUE,,27/07/2022,n/a,,FAIL INSTRUMENT,0.01,FALSE,FALSE,Charge,August 2022,,,
  Production 13,FF10125655,DTOL13012590,,0.67,,,12/07/2022,zg1,Cryoprep,70,Plant,1h@55C,N/A,,,Yes,FD38542399,SA01034044,E11,1.86,380,706.8,6.44,1.19,0.73,8.213,28972,3.1,2022 07 12 17H 10M,Pass,,,,,,13/07/2022,zg1,350,210,200,,Alan Shearer,30,200,0.6x AMPure PB (manual),TRUE,155,93,7.6,45.4,345.04,29.4,2.21,0.89,8.556,48.8,17400,7,2022 07 14 16H 17M,,Fail,,,low yield - ToL pass,,Submit to Lib Prep,drCraHelm1,0.66504,SE305511D,TRUE,,17/10/2022,n/a,,Not in WGS,Not in WGS,FALSE,FALSE,Charge,August 2022,,,
  Production 14,FD21232224,DTOL13012591,,1.26,,,19/07/2022,fs17,Powermash,0.01,Non-plant,2h@25C,NA,,,Yes,FD38542427,Rack 3,,1.72,390,670.8,5.88,1.45,1.78,2.292,21849,1.4,2022 07 19 19H 58M,Pass,,,,,,20/07/2022,fs17,N/A,N/A,N/A,,Ed Sheeran,30,374,0.6x AMPure PB (manual),TRUE,342,205.2,8.18,45.4,371.372,31.72,3.13,1.92,7.711,55.4,14511,4.1,2022 07 21 17H 59M,,Fail,Fail,,"low yield. underloaded. Re-run on Femto (2022 07 21 17H 59M), femto found and added to sheet",21/07/2022,Fail,icBytOchr1,1.26162,,TRUE,,,,,Not in WGS,Not in WGS,FALSE,FALSE,Charge,August 2022,,,
  Production 14,FD21232324,DTOL13012592,,0.16,,,19/07/2022,fs17,Powermash,0.01,Non-plant,2h@25C,,,,Yes,FD38542428,Rack 3,,0.752,390,293.28,2.008,1.61,7.9,1.329,55287,4.3,2022 07 19 19H 58M,On Hold ULI,,,,,Proceed to ULI,17/10/2022,lk11/mls,,,,,Gtube,,,0.6x AMPure PB (manual),FALSE,355,1100,3.76,45,169.2,,,,,57.7,12552,8,2022 10 18 22H 48M,,Pass,,,,,Proceed to ULI,icBraGlab1,0.15648,SE305612H,TRUE,,07/01/2022,n/a,,Not in WGS,Not in WGS,FALSE,FALSE,Charge,August 2022,,,
  Production 14,FF05128293,DTOL13012593,,0.48,,,19/07/2022,fs17,Cryoprep,23.3,Non-plant,2h@25C,NA,,,Yes,FD38542429,Rack 3,,11,390,4290,43,1.7,1.6,45.86,76772,4.2,2022 07 19 19H 58M,Pass,,,,,,20/07/2022,fs17,N/A,N/A,N/A,,Ed Sheeran,30,380,0.6x AMPure PB (manual),TRUE,348,208.8,36,45.4,1634.4,143,1.97,1.98,37.72,38.1,16443,8.6,2022 07 22 13H 15M,,Pass,,,"2022 07 20 21H 48M; peak of LMW DNA (11.5% sample); original gDNA also has large LMW DNA peak (39% sample <1000bp). Extra 0.45x SPRI (top up volume to 100uL with EB); original QC - Qubit: 70.4; Femto mode: 16300bp, 10kb GQN: 7.7; Nanodrop: 99.52, 260/280: 1.99, 260/230 1.99",21/07/2022,,ilManJurt4,0.47922,SE294009G,TRUE,,27/07/2022,n/a,,PASS,31.32,FALSE,FALSE,Charge,August 2022,,,
  Production 14,FF05128160,DTOL13012594,,0.66,,,19/07/2022,fs17,Powermash,22,Non-plant,2h@25C,NA,,,Yes,FD38542430,Rack 3,,9.28,390,3619.2,36.12,1.91,1,28.56,24129,2.4,2022 07 19 21H 26M,Pass,,,,,,20/07/2022,fs17,N/A,N/A,N/A,,Britney Shears,30,350,0.6x AMPure PB (manual),TRUE,346,207.6,59.6,45.4,2705.84,237.4,1.83,0.98,116.2,74.8,13081,7,2022 07 20 21H 48M,,Pass,,,eluate with colour,21/07/2022,,ilAntChix2,0.65526,SE293952J,TRUE,,21/07/2022,25.7,,PASS,18.59,FALSE,FALSE,Charge,August 2022,,,
  Production 14,FR25589357,DTOL13012595,,0.26,,,19/07/2022,fs17,Powermash,5,Non-plant,2h@25C,NA,,,Yes,FD38542431,Rack 3,,2.52,390,982.8,9.08,3.08,-6.05,2.347,20010,1.4,2022 07 19 21H 26M,Pass,,,,only 14% sample is above 30kb,,20/07/2022,fs17,N/A,N/A,N/A,,Ed Sheeran,30,370,0.6x AMPure PB (manual),TRUE,355,213,18.6,45.4,844.44,73.4,1.88,1.48,14.21,85.9,14154,7,2022 07 20 21H 48M,,Pass,,,,21/07/2022,,iyCliInci1,0.26406,SE293953K,TRUE,,21/07/2022,n/a,,PASS,21.73,FALSE,FALSE,Charge,August 2022,,,
  Production 14,FS05286958,DTOL13012596,,0.96,,,19/07/2022,fs17,Powermash,7,Non-plant,2h@25C,NA,,,Yes,FD38542432,Rack 3,,6.34,390,2472.6,24.36,2.12,25.88,23.99,23120,1.3,2022 07 19 21H 26M,Pass,,,,only 12.4% of sample is above 30kb,,20/07/2022,fs17,N/A,N/A,N/A,,Ed Sheeran,30,378,0.6x AMPure PB (manual),TRUE,349,209.4,19.3,45.4,876.22,76.2,1.95,2.22,19.39,35.4,12096,6.7,2022 07 22 13H 15M,,Pass,,,"2022 07 20 21H 48M; peak of LMW DNA (11% sample); original gDNA also has large LMW DNA peak (39% sample <1000bp). Extra 0.45x SPRI (top up volume to 100uL with EB); original QC - Qubit: 33.8; Femto mode: 11634bp, 10kb GQN: 5.6; Nanodrop: 50.19, 260/280: 2.11, 260/230: 2.21",21/07/2022,,ieCloSimi1,0.96333,SE294010W,TRUE,,27/07/2022,17.3,,PASS,20.67,FALSE,FALSE,Charge,August 2022,,,
  Production 14,FF05128148,DTOL13012597,,0.81,,,19/07/2022,fs17,Cryoprep,39,Non-plant,2h@25C,NA,,,Yes,FD38542433,Rack 3,,4.14,390,1614.6,15.56,2.24,1.75,17.68,63767,3.4,2022 07 19 21H 26M,Pass,,,,,,20/07/2022,fs17,N/A,N/A,N/A,,Britney Shears,30,355,0.6x AMPure PB (manual),TRUE,354,212.4,22.4,45.4,1016.96,88.6,2.02,2.1,31.69,63.0,13174,7.3,2022 07 20 21H 48M,,Pass,,,peak of LMW DNA (8% sample); original gDNA also has large LMW DNA peak (45% sample <1000bp). passed during meeting,21/07/2022,,iyCoeConi1,0.81174,SE293954L,TRUE,,21/07/2022,n/a,,PASS,19.19,FALSE,FALSE,Charge,August 2022,,,
